case_id,case_title,case_citation,parallel_cite,filed_date,not_rule36,number_of_patents,note,patent1,patent1_cpc,patent1_find_error,patent1_reverse,patent2,patent2_cpc,patent2_find_error,patent2_reverse,patent3,patent3_cpc,patent3_find_error,patent3_reverse,patent4,patent4_cpc,patent4_find_error,patent4_reverse,patent5,patent5_cpc,patent5_find_error,patent5_reverse,patent6,patent6_cpc,patent6_find_error,patent6_reverse,patent7,patent7_cpc,patent7_find_error,patent7_reverse
2202,"Stored Value Solutions, Inc. v. Card Activation Technologies, Inc.",499 Fed.Appx. 5,2012 WL 6097674,10/12/2012,1,1,,6032859,G07F7/02,0,0,,,,,,,,,,,,,,,,,,,,,,,,
2217,"Accentra, Inc. v. Staples, Inc.",500 Fed.Appx. 922,2013 WL 49556,4/1/2013,1,3,,7080768,B25C5/025,1,1,7290692,B25C5/11,0,0,7178709,B25C5/0242,1,1,,,,,,,,,,,,,,,,
2233,"Forest Laboratories, Inc. v. Ivax Pharmaceuticals, Inc.",501 F.3d 1263,84 U.S.P.Q.2d 1099,5/9/2007,1,1,,RE34712,,0,0,,,,,,,,,,,,,,,,,,,,,,,,
2235,"Gillespie v. Dywidag Systems Intern., USA",501 F.3d 1285,84 U.S.P.Q.2d 1051,6/9/2007,1,2,,5230589,E21D21/008,1,1,5259703,E21D21/008,1,1,,,,,,,,,,,,,,,,,,,,
2236,"ACCO Brands, Inc. v. ABA Locks Mfrs. Co., Ltd.",501 F.3d 1307,84 U.S.P.Q.2d 1267,12/9/2007,1,1,,5502989,E05B73/0005,0,0,,,,,,,,,,,,,,,,,,,,,,,,
2239,"Allergan, Inc. v. Barr Laboratories, Inc.",501 Fed.Appx. 965,2013 WL 314446,28/1/2013,1,1,,5688819,A61K31/559,0,0,,,,,,,,,,,,,,,,,,,,,,,,
2251,"Smith & Nephew, Inc. v. Arthrex, Inc.",502 Fed.Appx. 945,2013 WL 163823,16/1/2013,1,1,,5601557,A61F2/0811,1,1,,,,,,,,,,,,,,,,,,,,,,,,
2252,Harris Corp. v. Federal Exp. Corp.,502 Fed.Appx. 957,2013 WL 174185,17/1/2013,1,1,,6047165,G08G5/0013,1,1,,,,,,,,,,,,,,,,,,,,,,,,
2253,"Ernie Ball, Inc. v. Earvana, LLC",502 Fed.Appx. 971,2013 WL 261916,24/1/2013,1,1,,6433264,G10D1/04,0,0,,,,,,,,,,,,,,,,,,,,,,,,
2255,In re Gabapentin Patent Litigation,503 F.3d 1254,84 U.S.P.Q.2d 1651,21/9/2007,1,1,,6054482,C07C229/28,0,0,,,,,,,,,,,,,,,,,,,,,,,,
2256,Verizon Services Corp. v. Vonage Holdings Corp.,503 F.3d 1295,84 U.S.P.Q.2d 1609,26/9/2007,1,3,Cheif Judge Michel dissented,6282574,H04L61/4511,0,0,6104711,H04L61/4511,0,0,6359880,H04W84/16,1,1,,,,,,,,,,,,,,,,
2257,"Monsanto Co. v. Syngenta Seeds, Inc.",503 F.3d 1352,84 U.S.P.Q.2d 1705,4/10/2007,1,3,,5538880,C07K14/325,0,0,4940835,C12N15/8275,0,0,6013863,C07K14/325,0,0,,,,,,,,,,,,,,,,
2262,"AllVoice Computing PLC v. Nuance Communications, Inc.",504 F.3d 1236,84 U.S.P.Q.2d 1886,12/10/2007,1,1,,5799273,G06F3/167,1,1,,,,,,,,,,,,,,,,,,,,,,,,
2263,"In re Translogic Technology, Inc.",504 F.3d 1249,84 U.S.P.Q.2d 1929,12/10/2007,1,1,,5162666,H04J3/047,0,0,,,,,,,,,,,,,,,,,,,,,,,,
2265,"Immunocept, LLC v. Fulbright & Jaworski, LLP",504 F.3d 1281,85 U.S.P.Q.2d 1085,15/10/2007,1,1,,5571418,A61M1/34,0,0,,,,,,,,,,,,,,,,,,,,,,,,
2267,"CIAS, Inc. v. Alliance Gaming Corp.",504 F.3d 1356,84 U.S.P.Q.2d 1737,27/9/2007,1,1,,5283422,G07F1/06,1,0,,,,,,,,,,,,,,,,,,,,,,,,
2280,U.S. Philips Corp. v. Iwasaki Elec. Co. Ltd.,505 F.3d 1371,85 U.S.P.Q.2d 1097,2/11/2007,1,1,,5109181,H01J61/12,0,0,,,,,,,,,,,,,,,,,,,,,,,,
2290,"Z4 Technologies, Inc. v. Microsoft Corp.",507 F.3d 1340,85 U.S.P.Q.2d 1340,16/11/2007,1,2,,6044471,G06F21/121,1,0,6785825,G06F21/121,1,0,,,,,,,,,,,,,,,,,,,,
2291,"Stumbo v. Eastman Outdoors, Inc.",508 F.3d 1358,85 U.S.P.Q.2d 1275,28/11/2007,1,1,,5628338,E04H15/40,0,0,,,,,,,,,,,,,,,,,,,,,,,,
2292,"Elbex Video, Ltd. v. Sensormatic Electronics Corp.",508 F.3d 1366,85 U.S.P.Q.2d 1137,28/11/2007,1,1,,4989085,G08B13/1961,1,1,,,,,,,,,,,,,,,,,,,,,,,,
2295,"Leoutsakos v. Coll's Hosp. Pharmacy, Inc.",51 Fed.Appx. 310,2002 WL 31546018,15/11/2002,1,1,,5400450,A47C21/08,0,0,,,,,,,,,,,,,,,,,,,,,,,,
2297,"Nikken USA, Inc. v. Robinsons-May, Inc.",51 Fed.Appx. 874,65 U.S.P.Q.2d 1611,20/11/2002,1,2,,5304111,A61N2/06,1,1,4489711,A61N2/06,1,1,,,,,,,,,,,,,,,,,,,,
2299,"Cordis Corp. v. Medtronic Ave, Inc.",511 F.3d 1157,85 U.S.P.Q.2d 1427,7/1/2008,1,1,,4739762,A61F2/91,1,1,,,,,,,,,,,,,,,,,,,,,,,,
2301,"Baldwin Graphic Systems, Inc. v. Siebert, Inc.",512 F.3d 1338,85 U.S.P.Q.2d 1503,15/1/2008,1,2,,RE35976,,1,0,5974976,B41F35/00,1,1,,,,,,,,,,,,,,,,,,,,
2302,"Innogenetics, N.V. v. Abbott Laboratories",512 F.3d 1363,85 U.S.P.Q.2d 1641,17/1/2008,1,1,,5846704,C12Q1/707,0,0,,,,,,,,,,,,,,,,,,,,,,,,
2306,Monsanto Co. v. Bayer Bioscience N.V.,514 F.3d 1229,85 U.S.P.Q.2d 1582,25/1/2008,1,4,,5254799,C07K14/325,0,0,,,,,,,,,,,,,,,,,,,,,,,,
2307,"Halliburton Energy Services, Inc. v. M-I LLC",514 F.3d 1244,85 U.S.P.Q.2d 1654,25/1/2008,1,1,,6887832,C09K8/34,0,0,,,,,,,,,,,,,,,,,,,,,,,,
2308,"TriMed, Inc. v. Stryker Corp.",514 F.3d 1256,85 U.S.P.Q.2d 1787,29/1/2008,1,1,,5931839,A61B17/80,1,1,,,,,,,,,,,,,,,,,,,,,,,,
2310,Oatey Co. v. IPS Corp.,514 F.3d 1271,85 U.S.P.Q.2d 1791,30/1/2008,1,1,,6148850,F16L5/14,1,1,,,,,,,,,,,,,,,,,,,,,,,,
2311,"Miken Composites, L.L.C. v. Wilson Sporting Goods Co.",515 F.3d 1331,85 U.S.P.Q.2d 1865,6/2/2008,1,1,,5415398,A63B59/51,0,0,,,,,,,,,,,,,,,,,,,,,,,,
2320,"TiVo, Inc. v. EchoStar Communications Corp.",516 F.3d 1290,85 U.S.P.Q.2d 1801,31/1/2008,1,1,,6233389,H04N5/775,0,0,,,,,,,,,,,,,,,,,,,,,,,,
2321,"Chamberlain Group, Inc. v. Lear Corp.",516 F.3d 1331,86 U.S.P.Q.2d 1104,19/2/2008,1,1,,6154544,H04L9/32,1,1,,,,,,,,,,,,,,,,,,,,,,,,
2324,"Sitrick v. Dreamworks, LLC",516 F.3d 993,85 U.S.P.Q.2d 1826,1/2/2008,1,1,,5553864,H04N5/272,0,0,,,,,,,,,,,,,,,,,,,,,,,,
2330,"Regents of University of Cal. v. Dakocytomation Cal., Inc.",517 F.3d 1364,85 U.S.P.Q.2d 1929,28/2/2008,1,1,,6596479,C12Q1/6832,1,1,,,,,,,,,,,,,,,,,,,,,,,,
2334,"Computer Docking Station Corp. v. Dell, Inc.",519 F.3d 1366,86 U.S.P.Q.2d 1129,21/3/2008,1,1,,5187645,G06F1/1656,0,0,,,,,,,,,,,,,,,,,,,,,,,,
2335,"BASF Agro B.V. v. Makhteshim Agan of North America, Inc.",519 Fed.Appx. 1008,2013 WL 1136714,20/3/2013,1,2,,6414010,A01M1/245,0,0,6835743,A01M1/245,0,0,,,,,,,,,,,,,,,,,,,,
2337,"K&K Jump Start/Chargers, Inc. v. Schumacher Elec. Corp.",52 Fed.Appx. 135,2002 WL 31684820,25/11/2002,1,1,,5183407,H02G15/043,0,0,,,,,,,,,,,,,,,,,,,,,,,,
2339,"Ortho-McNeil Pharmaceutical, Inc. v. Mylan Laboratories, Inc.",520 F.3d 1358,86 U.S.P.Q.2d 1196,31/3/2008,1,1,,4513006,C07H9/04,0,0,,,,,,,,,,,,,,,,,,,,,,,,
2340,Microprocessor Enhancement Corp. v. Texas Instruments Inc.,520 F.3d 1367,86 U.S.P.Q.2d 1225,1/4/2008,1,1,,5471593,G06F9/30018,0,0,,,,,,,,,,,,,,,,,,,,,,,,
2343,Aristocrat Technologies Australia Pty Ltd. v. International Game Technology,521 F.3d 1328,86 U.S.P.Q.2d 1235,28/3/2008,1,1,,6093102,G07F17/34,0,0,,,,,,,,,,,,,,,,,,,,,,,,
2344,"O2 Micro Intern. Ltd. v. Beyond Innovation Technology Co., Ltd.",521 F.3d 1351,86 U.S.P.Q.2d 1304,3/4/2008,1,3,,6259615,H02M7/523,1,1,6396722,H02M7/523,1,1,6804129,H05B41/3927,1,1,,,,,,,,,,,,,,,,
2354,"Symantec Corp. v. Computer Associates Intern., Inc.",522 F.3d 1279,86 U.S.P.Q.2d 1449,11/4/2008,1,1,,5319776,H04L63/145,1,1,,,,,,,,,,,,,,,,,,,,,,,,
2356,"Zenith Electronics Corp. v. PDI Communication Systems, Inc.",522 F.3d 1348,86 U.S.P.Q.2d 1513,16/4/2008,1,1,,5495301,H04N5/60,0,0,5502513,H04N5/44,1,1,,,,,,,,,,,,,,,,,,,,
2362,"Finisar Corp. v. DirecTV Group, Inc.",523 F.3d 1323,86 U.S.P.Q.2d 1609,18/4/2008,1,1,,5404505,H04H40/90,1,1,,,,,,,,,,,,,,,,,,,,,,,,
2367,"Ottah v. VeriFone Systems, Inc.",524 Fed.Appx. 627,108 U.S.P.Q.2d 2022,8/4/2013,1,1,,7152840,A47B23/02,0,0,,,,,,,,,,,,,,,,,,,,,,,,
2368,"Capital Mach. Co., Inc. v. Miller Veneers, Inc.",524 Fed.Appx. 644,2013 WL 1501579,15/4/2013,1,6,,5562137,B27C3/04,1,1,5694995,B27L5/04,1,1,5701938,B27C3/04,1,1,5678619,B27C3/04,0,0,5819828,B27C3/04,1,1,7395843,B25B5/061,1,1,,,,
2369,"Speedtrack, Inc. v. Endeca Technologies, Inc.",524 Fed.Appx. 651,106 U.S.P.Q.2d 1442,16/4/2013,1,1,,5544360,G06F16/168,0,0,,,,,,,,,,,,,,,,,,,,,,,,
2370,"PSN Illinois, LLC v. Ivoclar Vivadent, Inc.",525 F.3d 1159,86 U.S.P.Q.2d 1892,6/5/2008,1,1,,4579530,A61C5/20,1,0,,,,,,,,,,,,,,,,,,,,,,,,
2371,"Lucent Technologies, Inc. v. Gateway, Inc.",525 F.3d 1200,87 U.S.P.Q.2d 1001,8/5/2008,1,2,Judge Lourie dissented,5649131,G06F3/038,1,1,4701954,G10L19/10,0,0,,,,,,,,,,,,,,,,,,,,
2372,"Mangosoft, Inc. v. Oracle Corp.",525 F.3d 1327,86 U.S.P.Q.2d 1939,14/5/2008,1,1,,6148377,G06F9/5016,0,0,,,,,,,,,,,,,,,,,,,,,,,,
2374,"Creative Integrated Systems, Inc. v. Nintendo of America, Inc.",526 Fed.Appx. 927,2013 WL 2378555,3/6/2013,1,1,,5241497,G11C7/1057,1,1,,,,,,,,,,,,,,,,,,,,,,,,
2378,"Decisioning.com, Inc. v. Federated Dept. Stores, Inc.",527 F.3d 1300,86 U.S.P.Q.2d 1769,7/5/2008,1,1,Judge Linn dissents regarding claim construction,6105007,G07F7/08,1,1,,,,,,,,,,,,,,,,,,,,,,,,
2380,"Metropolitan Life Ins. Co. v. Bancorp Services, L.L.C.",527 F.3d 1330,70 Fed.R.Serv.3d 1235,2/6/2008,1,1,,5926792,G06Q40/08,0,0,,,,,,,,,,,,,,,,,,,,,,,,
2381,"Helmsderfer v. Bobrick Washroom Equipment, Inc.",527 F.3d 1379,87 U.S.P.Q.2d 1216,4/6/2008,1,1,,6049928,A47D5/006,0,0,,,,,,,,,,,,,,,,,,,,,,,,
2389,Scanner Technologies Corp. v. ICOS Vision Systems Corp. N.V.,528 F.3d 1365,87 U.S.P.Q.2d 1225,19/6/2008,1,2,,6064756,G06T7/0002,0,0,6064757,G06T7/0002,0,0,,,,,,,,,,,,,,,,,,,,
2390,"Cat Tech LLC v. TubeMaster, Inc.",528 F.3d 871,87 U.S.P.Q.2d 1065,28/5/2008,1,1,,6905660,B01J8/003,0,0,,,,,,,,,,,,,,,,,,,,,,,,
2403,"TIP Systems, LLC v. Phillips & Brooks/Gladwin, Inc.",529 F.3d 1364,87 U.S.P.Q.2d 1254,18/6/2008,1,2,,6009169,H04M1/18,0,0,6512828,H04M1/0291,0,0,,,,,,,,,,,,,,,,,,,,
2420,"Roche Palo Alto LLC v. Apotex, Inc.",531 F.3d 1372,87 U.S.P.Q.2d 1308,9/7/2008,1,1,,5110493,A61K9/0048,0,0,,,,,,,,,,,,,,,,,,,,,,,,
2425,"JuxtaComm-Texas Software, LLC v. TIBCO Software, Inc.",532 Fed.Appx. 911,2013 WL 5421673,30/9/2013,1,1,,6195662,G06F40/151,0,0,,,,,,,,,,,,,,,,,,,,,,,,
2426,Board of Regents of the University of Texas System v. BENQ America Corp.,533 F.3d 1362,87 U.S.P.Q.2d 1437,24/7/2008,1,1,,4674112,H04M11/066,0,0,,,,,,,,,,,,,,,,,,,,,,,,
2449,Voda v. Cordis Corp.,536 F.3d 1311,87 U.S.P.Q.2d 1742,18/8/2008,1,1,,6083213,A61M25/0041,1,1,,,,,,,,,,,,,,,,,,,,,,,,
2451,In re Omeprazole Patent Litigation,536 F.3d 1361,87 U.S.P.Q.2d 1865,20/8/2008,1,2,,4786505,A61K31/44,0,0,4853230,A61K31/415,0,0,,,,,,,,,,,,,,,,,,,,
2452,"DSW, Inc. v. Shoe Pavilion, Inc.",537 F.3d 1342,87 U.S.P.Q.2d 1687,19/8/2008,1,1,,6948622,A47F7/08,1,1,,,,,,,,,,,,,,,,,,,,,,,,
2453,"Leggett & Platt, Inc. v. VUTEk, Inc.",537 F.3d 1349,87 U.S.P.Q.2d 1947,21/8/2008,1,3,,6755518,B41J11/00214,0,0,6457823,B41J2/01,0,0,6616355,B41J25/3086,0,0,,,,,,,,,,,,,,,,
2455,"800 Adept, Inc. v. Murex Securities, Ltd.",539 F.3d 1354,88 U.S.P.Q.2d 1065,29/8/2008,1,1,,RE36111,,1,1,,,,,,,,,,,,,,,,,,,,,,,,
2457,"Howmedica Osteonics Corp. v. Wright Medical Technology, Inc.",540 F.3d 1337,88 U.S.P.Q.2d 1129,2/9/2008,1,1,,5824100,A61F2/3886,1,1,,,,,,,,,,,,,,,,,,,,,,,,
2471,"Mikkelsen Graphic Engineering, Inc. v. Zund America, Inc.",541 Fed.Appx. 964,2013 WL 4269406,16/8/2013,1,2,,6619168,B26D5/34,0,0,6672187,B26D5/007,0,0,,,,,,,,,,,,,,,,,,,,
2475,"Commonwealth Scientific and Indus. Research Organisation v. Buffalo Technology (USA), Inc.",542 F.3d 1363,88 U.S.P.Q.2d 1564,19/9/2008,1,1,,5487069,H04L1/006,0,0,,,,,,,,,,,,,,,,,,,,,,,,
2478,AstraZeneca LP v. Breath Ltd.,542 Fed.Appx. 971,2013 WL 5813759,30/10/2013,1,1,,7524834,A61K9/0075,1,1,,,,,,,,,,,,,,,,,,,,,,,,
2481,"Praxair, Inc. v. ATMI, Inc.",543 F.3d 1306,88 U.S.P.Q.2d 1705,29/9/2008,1,3,,6007609,F17C13/04,0,0,6045115,F16K1/305,0,0,5937895,F16K1/305,1,1,,,,,,,,,,,,,,,,
2483,"Cohesive Technologies, Inc. v. Waters Corp.",543 F.3d 1351,88 U.S.P.Q.2d 1903,7/10/2008,1,2,,5772874,G01N30/482,1,1,5919368,G01N30/482,1,1,,,,,,,,,,,,,,,,,,,,
2485,Broadcom Corp. v. Qualcomm Inc.,543 F.3d 683,88 U.S.P.Q.2d 1641,24/9/2008,1,3,,6847686,H04N19/53,1,1,5657317,H04W52/343,0,0,,,,,,,,,,,,,,,,,,,,
2487,"Lee v. Mike's Novelties, Inc.",543 Fed.Appx. 1010,2013 WL 6097232,21/11/2013,1,1,,6418936,A24F5/00,0,0,,,,,,,,,,,,,,,,,,,,,,,,
2488,"Predicate Logic, Inc. v. Distributive Software, Inc.",544 F.3d 1298,88 U.S.P.Q.2d 1526,9/10/2008,1,1,,5930798,G05B17/02,1,1,,,,,,,,,,,,,,,,,,,,,,,,
2490,"Abbott Laboratories v. Sandoz, Inc.",544 F.3d 1341,89 U.S.P.Q.2d 1161,21/10/2008,1,2,,6010718,A61K31/7048,0,0,6551616,A61K31/7048,0,0,,,,,,,,,,,,,,,,,,,,
2491,Kruse Technology Partnership v. Volkswagen AG,544 Fed.Appx. 943,2013 WL 5526526,8/10/2013,1,2,Judge Wallach dissents regarding claim construction,5265562,F02B75/02,0,0,6058904,F02B75/02,0,0,,,,,,,,,,,,,,,,,,,,
2492,"Piggy Pushers, LLC v. Skidders Footwear, Inc.",544 Fed.Appx. 984,2013 WL 5951969,8/11/2013,1,1,,6385779,A41B13/00,0,0,,,,,,,,,,,,,,,,,,,,,,,,
2495,"Net MoneyIN, Inc. v. VeriSign, Inc.",545 F.3d 1359,88 U.S.P.Q.2d 1751,20/10/2008,1,1,,5963917,G06Q20/02,0,0,,,,,,,,,,,,,,,,,,,,,,,,
2497,"Cooper Notification, Inc. v. Twitter, Inc.",545 Fed.Appx. 959,2013 WL 4611752,30/8/2013,1,1,,7409428,H04L51/234,0,0,,,,,,,,,,,,,,,,,,,,,,,,
2507,"Centillion Data Systems, LLC v. Qwest Communications Intern., Inc.",547 Fed.Appx. 980,2013 WL 6153261,25/11/2013,1,1,,5287270,G06Q30/04,0,0,,,,,,,,,,,,,,,,,,,,,,,,
2508,"Vistan Corp. v. Fadei USA, Inc.",547 Fed.Appx. 986,2013 WL 6231725,3/12/2013,1,1,,5870949,A23N4/08,1,1,,,,,,,,,,,,,,,,,,,,,,,,
2515,"Netcraft Corp. v. eBay, Inc.",549 F.3d 1394,89 U.S.P.Q.2d 1234,9/12/2008,1,2,,6351739,G06Q20/102,0,0,6976008,G06Q20/102,0,0,,,,,,,,,,,,,,,,,,,,
2518,"Bennett Marine, Inc. v. Lenco Marine, Inc.",549 Fed.Appx. 947,2013 WL 5273116,19/9/2013,1,1,,5113780,B63B39/061,1,1,,,,,,,,,,,,,,,,,,,,,,,,
2521,"Old Town Canoe Co. v. Glenwa, Inc.",55 Fed.Appx. 918,2003 WL 124523,14/1/2003,1,3,,5964177,B63B1/042,1,1,6152063,B63B1/042,1,1,6178912,B63B35/34,1,1,,,,,,,,,,,,,,,,
2522,"iLOR, LLC v. Google, Inc.",550 F.3d 1067,89 U.S.P.Q.2d 1097,11/12/2008,1,1,,7206839,G06F16/957,0,0,,,,,,,,,,,,,,,,,,,,,,,,
2523,"Welker Bearing Co. v. PHD, Inc.",550 F.3d 1090,89 U.S.P.Q.2d 1289,15/12/2008,1,2,,6913254,B23Q16/001,0,0,,,,,,,,,,,,,,,,,,,,,,,,
2539,Hemphill v. Johnson & Johnson,550 Fed.Appx. 890,2014 WL 114157,14/1/2014,1,1,,4557720,A61M31/007,0,0,,,,,,,,,,,,,,,,,,,,,,,,
2564,"Superior Industries, Inc. v. Masaba, Inc.",553 Fed.Appx. 986,2014 WL 163046,16/1/2014,1,2,,7470101,B65G41/002,1,1,7618213,E02B11/005,1,1,,,,,,,,,,,,,,,,,,,,
2565,"Sud-Chemie, Inc. v. Multisorb Technologies, Inc.",554 F.3d 1001,89 U.S.P.Q.2d 1768,30/1/2009,1,1,,5793942,G11C29/88,1,1,,,,,,,,,,,,,,,,,,,,,,,,
2566,"Kinetic Concepts, Inc. v. Blue Sky Medical Group, Inc.",554 F.3d 1010,89 U.S.P.Q.2d 1801,2/2/2009,1,2,Judge DYK held a dissenting opinion with respect to claim construction.,5636643,A61M27/00,1,0,5645081,A61M27/00,1,0,,,,,,,,,,,,,,,,,,,,
2568,"Boston Scientific Scimed, Inc. v. Cordis Corp.",554 F.3d 982,89 U.S.P.Q.2d 1704,15/1/2009,1,1,,6120536,A61L33/0011,0,0,,,,,,,,,,,,,,,,,,,,,,,,
2569,"AstraZeneca AB v. Hanmi USA, Inc.",554 Fed.Appx. 912,2013 WL 6670610,19/12/2013,1,1,Judge Mayer dissented,5714504,C07D401/12,0,0,5877192,C07D401/12,0,0,,,,,,,,,,,,,,,,,,,,
2570,"Realtime Data, LLC v. Morgan Stanley",554 Fed.Appx. 923,2014 WL 278757,27/1/2014,1,3,,7417568,H04L65/1101,0,0,7714747,H03M7/3088,0,0,7777651,H04L65/1101,0,0,,,,,,,,,,,,,,,,
2573,"Ball Aerosol and Specialty Container, Inc. v. Limited Brands, Inc.",555 F.3d 984,89 U.S.P.Q.2d 1870,9/2/2009,1,1,,6457969,F21V35/00,0,0,,,,,,,,,,,,,,,,,,,,,,,,
2574,"Pfizer Inc. v. Teva Pharmaceuticals USA, Inc.",555 Fed.Appx. 961,109 U.S.P.Q.2d 1652,6/2/2014,1,1,,6197819,A61K31/197,0,0,,,,,,,,,,,,,,,,,,,,,,,,
2593,Otto Bock HealthCare LP v. %20Ossur HF,557 Fed.Appx. 950,2014 WL 593555,18/2/2014,1,1,,6726726,A61F2/5046,0,0,,,,,,,,,,,,,,,,,,,,,,,,
2601,"ICU Medical, Inc. v. Alaris Medical Systems, Inc.",558 F.3d 1368,90 U.S.P.Q.2d 1072,13/3/2009,1,4,,6682509,A61M5/14,0,0,5685866,A61M5/14,0,0,5873862,A61M5/14,0,0,6572592,A61M5/14,0,0,,,,,,,,,,,,
2605,"Bose Corp. v. SDI Technologies, Inc.",558 Fed.Appx. 1012,2014 WL 982765,14/3/2014,1,1,,7277765,H04B1/20,0,0,,,,,,,,,,,,,,,,,,,,,,,,
2609,"Cyberfone Systems, LLC v. CNN Interactive Group, Inc.",558 Fed.Appx. 988,2014 WL 718153,26/2/2014,1,1,,8019060,G06F40/174,0,0,,,,,,,,,,,,,,,,,,,,,,,,
2614,"Novatek, Inc. v. Sollami Co.",559 Fed.Appx. 1011,2014 WL 1229547,26/3/2014,1,2,,7883155,E02F9/2866,0,0,6371567,E21C35/197,0,0,,,,,,,,,,,,,,,,,,,,
2616,"Molten Metal Equipment Innovations, Inc. v. Metaullics Systems Co., L.P.",56 Fed.Appx. 475,2003 WL 236614,30/1/2003,1,1,,5203681,F04D29/044,0,0,,,,,,,,,,,,,,,,,,,,,,,,
2617,"Wechsler v. Macke Intern. Trade, Inc.",56 Fed.Appx. 935,2003 WL 193604,29/1/2003,1,1,,5636592,A01K7/02,1,1,,,,,,,,,,,,,,,,,,,,,,,,
2623,Cordis Corp. v. Boston Scientific Corp.,561 F.3d 1319,90 U.S.P.Q.2d 1401,31/3/2009,1,3,,4739762,A61F2/91,0,0,5895406,A61F2/91,0,0,5922021,A61F2/915,0,0,,,,,,,,,,,,,,,,
2624,"e2Interactive, Inc. v. Blackhawk Network, Inc.",561 Fed.Appx. 895,2014 WL 943188,12/3/2014,1,1,,7578439,G06Q20/28,1,1,,,,,,,,,,,,,,,,,,,,,,,,
2625,HowLink Global LLC v. Network Communications Intern. Corp.,561 Fed.Appx. 898,2014 WL 1303372,2/4/2014,1,1,,7876744,H04M15/08,0,0,,,,,,,,,,,,,,,,,,,,,,,,
2626,"United Video Properties, Inc. v. Amazon.com, Inc.",561 Fed.Appx. 914,2014 WL 1363539,8/4/2014,1,2,,6769128,H04N7/173,0,0,7603690,H04N21/4668,0,0,,,,,,,,,,,,,,,,,,,,
2629,"University of Pittsburgh of Commonwealth System of Higher Educ. v. Varian Medical Systems, Inc.",561 Fed.Appx. 934,2014 WL 1387144,10/4/2014,1,1,Circuit Judge Dyk dissented,5727554,A61B6/08,1,1,,,,,,,,,,,,,,,,,,,,,,,,
2633,"Felix v. American Honda Motor Co., Inc.",562 F.3d 1167,90 U.S.P.Q.2d 1524,10/4/2009,1,1,,6155625,B60R9/00,0,0,,,,,,,,,,,,,,,,,,,,,,,,
2645,"Revolution Eyewear, Inc. v. Aspex Eyewear, Inc.",563 F.3d 1358,90 U.S.P.Q.2d 1733,29/4/2009,1,1,,RE37545,,0,0,,,,,,,,,,,,,,,,,,,,,,,,
2646,"Every Penny Counts, Inc. v. American Express Co.",563 F.3d 1378,90 U.S.P.Q.2d 1851,30/4/2009,1,1,,5621640,G06Q40/02,0,0,,,,,,,,,,,,,,,,,,,,,,,,
2668,"Paragon Solutions, LLC v. Timex Corp.",566 F.3d 1075,91 U.S.P.Q.2d 1082,22/5/2009,1,1,,6736759,A63B24/0021,1,1,,,,,,,,,,,,,,,,,,,,,,,,
2669,"Abbott Laboratories v. Sandoz, Inc.",566 F.3d 1282,90 U.S.P.Q.2d 1769,18/5/2009,1,1,Judge Newman dissented,4935507,A61K31/545,0,0,,,,,,,,,,,,,,,,,,,,,,,,
2672,"Nassau Precision Casting Co., Inc. v. Acushnet Co., Inc.",566 Fed.Appx. 933,2014 WL 2535260,6/6/2014,1,1,,5486000,A63B53/04,1,1,,,,,,,,,,,,,,,,,,,,,,,,
2673,"DePuy Spine, Inc. v. Medtronic Sofamor Danek, Inc.",567 F.3d 1314,90 U.S.P.Q.2d 1865,1/6/2009,1,1,,5207678,A61B17/7037,0,0,,,,,,,,,,,,,,,,,,,,,,,,
2674,"Agilent Technologies, Inc. v. Affymetrix, Inc.",567 F.3d 1366,91 U.S.P.Q.2d 1161,4/6/2009,1,1,,6513968,B01L3/502707,1,1,,,,,,,,,,,,,,,,,,,,,,,,
2677,"Ecolab, Inc. v. FMC Corp.",569 F.3d 1335,91 U.S.P.Q.2d 1225,9/6/2009,1,1,,5632676,A22C21/04,0,0,,,,,,,,,,,,,,,,,,,,,,,,
2678,Deere & Co. v. Toro Co.,57 Fed.Appx. 442,2003 WL 249712,4/2/2003,1,1,,5988290,A01B45/023,1,1,,,,,,,,,,,,,,,,,,,,,,,,
2679,"Kensey Nash Corp. v. Perclose, Inc.",57 Fed.Appx. 864,2003 WL 262343,5/2/2003,1,2,,5676689,A61B17/0057,0,0,5861004,A61B17/0057,0,0,,,,,,,,,,,,,,,,,,,,
2680,Gemtron Corp. v. Saint-Gobain Corp.,572 F.3d 1371,91 U.S.P.Q.2d 1409,20/7/2009,1,2,,6679573,F25D25/024,0,0,6422673,F25D25/024,0,0,,,,,,,,,,,,,,,,,,,,
2683,Wavetronix LLC v. EIS Electronic Integrated Systems,573 F.3d 1343,91 U.S.P.Q.2d 1468,29/7/2009,1,1,DC failed to construct,6556916,G08G1/042,0,0,,,,,,,,,,,,,,,,,,,,,,,,
2684,"Blackboard, Inc. v. Desire2Learn, Inc.",574 F.3d 1371,91 U.S.P.Q.2d 1481,27/7/2009,1,1,,6988138,G09B5/02,1,1,,,,,,,,,,,,,,,,,,,,,,,,
2688,Callaway Golf Co. v. Acushnet Co.,576 F.3d 1331,91 U.S.P.Q.2d 1705,14/8/2009,1,1,,6210293,C08L23/08,0,0,,,,,,,,,,,,,,,,,,,,,,,,
2690,"Martek Biosciences Corp. v. Nutrinova, Inc.",579 F.3d 1363,92 U.S.P.Q.2d 1148,3/9/2009,1,2,Judge Lourie held a dissenting opinion with respect to claim construction.,6410281,C12P7/6472,0,0,5698244,C12P7/6427,1,1,,,,,,,,,,,,,,,,,,,,
2693,"Nystrom v. Trex Co., Inc.",580 F.3d 1281,92 U.S.P.Q.2d 1060,8/9/2009,1,1,,5474831,E04F15/04,0,0,,,,,,,,,,,,,,,,,,,,,,,,
2695,Amgen Inc. v. F. Hoffman-La Roche Ltd,580 F.3d 1340,92 U.S.P.Q.2d 1289,15/9/2009,1,2,,5955422,C07K14/505,0,0,5547933,C07K14/505,0,0,,,,,,,,,,,,,,,,,,,,
2696,"Vita-Mix Corp. v. Basic Holding, Inc.",581 F.3d 1317,92 U.S.P.Q.2d 1340,16/9/2009,1,1,,5302021,B01F35/00,0,0,,,,,,,,,,,,,,,,,,,,,,,,
2699,Edwards Lifesciences LLC v. Cook Inc.,582 F.3d 1322,92 U.S.P.Q.2d 1599,22/9/2009,1,4,,6582458,A61F2/07,0,0,6613073,A61F2/07,0,0,6685736,A61F2/07,0,0,6689158,A61F2/07,0,0,,,,,,,,,,,,
2700,Kara Technology Inc. v. Stamps.com Inc.,582 F.3d 1341,92 U.S.P.Q.2d 1252,24/9/2009,1,2,,6505179,H04N1/32133,1,1,6735575,H04N1/32133,1,1,,,,,,,,,,,,,,,,,,,,
2701,"Board of Trustees of Leland Stanford Junior University v. Roche Molecular Systems, Inc.",583 F.3d 832,249 Ed. Law Rep. 612,30/9/2009,1,3,,5968730,C12Q1/703,0,0,6503705,C12Q1/703,0,0,7129041,C12Q1/703,0,0,,,,,,,,,,,,,,,,
2704,"Perfect Web Technologies, Inc. v. InfoUSA, Inc.",587 F.3d 1324,92 U.S.P.Q.2d 1849,2/12/2009,1,1,,6631400,G06Q10/107,0,0,,,,,,,,,,,,,,,,,,,,,,,,
2705,Ultimax Cement Mfg. Corp. v. CTS Cement Mfg. Corp.,587 F.3d 1339,92 U.S.P.Q.2d 1865,3/12/2009,1,3,,4957556,C04B7/323,1,1,6113684,C04B7/32,0,0,6406534,C04B7/32,0,0,,,,,,,,,,,,,,,,
2709,i4i Ltd. Partnership v. Microsoft Corp.,589 F.3d 1246,93 U.S.P.Q.2d 1161,22/12/2009,1,1,,5787449,G06F40/106,0,0,,,,,,,,,,,,,,,,,,,,,,,,
2710,"Systems Division, Inc. v. Teknek LLC",59 Fed.Appx. 333,2003 WL 475588,21/2/2003,1,3,,5813073,H05K3/26,1,1,5989358,H05K3/26,1,1,6200392,H05K3/26,1,1,,,,,,,,,,,,,,,,
2711,"Forest Group, Inc. v. Bon Tool Co.",590 F.3d 1295,93 U.S.P.Q.2d 1097,28/12/2009,1,1,,5645515,A63B25/00,0,0,,,,,,,,,,,,,,,,,,,,,,,,
2712,Koninklijke Philips Electronics N.V. v. Cardiac Science Operating Co.,590 F.3d 1326,93 U.S.P.Q.2d 1227,5/1/2010,1,1,,6241751,A61N1/3943,1,1,,,,,,,,,,,,,,,,,,,,,,,,
2713,Schindler Elevator Corp. v. Otis Elevator Co.,593 F.3d 1275,93 U.S.P.Q.2d 1262,15/1/2010,1,1,,5689094,B66B1/468,1,1,,,,,,,,,,,,,,,,,,,,,,,,
2714,"Therasense, Inc. v. Becton, Dickinson and Co.",593 F.3d 1289,93 U.S.P.Q.2d 1489,25/1/2010,1,3,,5820551,A61B5/1486,1,0,6143164,G01N27/3272,1,0,6592745,G01N27/3272,1,0,,,,,,,,,,,,,,,,
2716,"SEB S.A. v. Montgomery Ward & Co., Inc.",594 F.3d 1360,93 U.S.P.Q.2d 1617,5/2/2010,1,1,,4995312,A47J27/004,0,0,,,,,,,,,,,,,,,,,,,,,,,,
2718,"Trading Technologies Intern., Inc. v. eSpeed, Inc.",595 F.3d 1340,93 U.S.P.Q.2d 1805,25/2/2010,1,2,,6772132,G06Q40/04,0,0,6766304,G06Q40/04,0,0,,,,,,,,,,,,,,,,,,,,
2720,"Comaper Corp. v. Antec, Inc.",596 F.3d 1343,93 U.S.P.Q.2d 1873,1/3/2010,1,1,,5955955,G06F1/206,0,0,,,,,,,,,,,,,,,,,,,,,,,,
2726,i4i Ltd. Partnership v. Microsoft Corp.,598 F.3d 831,93 U.S.P.Q.2d 1943,10/3/2010,1,1,,5787449,G06F40/106,0,0,,,,,,,,,,,,,,,,,,,,,,,,
2727,Marrin v. Griffin,599 F.3d 1290,94 U.S.P.Q.2d 1140,22/3/2010,1,1,Judge Newman dissents regarding claim construction,5154448,G09F3/0292,0,0,,,,,,,,,,,,,,,,,,,,,,,,
2728,"Pressure Products Medical Supplies, Inc. v. Greatbatch Ltd.",599 F.3d 1308,94 U.S.P.Q.2d 1261,24/3/2010,1,1,,5688648,G01N33/582,0,0,,,,,,,,,,,,,,,,,,,,,,,,
2729,"Enzo Biochem, Inc. v. Applera Corp.",599 F.3d 1325,94 U.S.P.Q.2d 1321,26/3/2010,1,4,,5328824,C07H19/20,1,1,5449767,C07H19/20,1,1,5476928,C07H19/20,1,1,5082830,C12Q1/6832,0,0,,,,,,,,,,,,
2730,"Power-One, Inc. v. Artesyn Technologies, Inc.",599 F.3d 1343,94 U.S.P.Q.2d 1241,30/3/2010,1,1,,7000125,H02J1/102,0,0,,,,,,,,,,,,,,,,,,,,,,,,
2731,Maltezos v. AT&T Corp.,6 Fed.Appx. 850,2001 WL 233378,8/3/2001,1,1,,5014301,H04M17/02,0,0,,,,,,,,,,,,,,,,,,,,,,,,
2732,"Optimal Recreation Solutions LLP v. Leading Edge Technologies, Inc.",6 Fed.Appx. 873,2001 WL 338152,6/4/2001,1,1,,5364093,G01S19/19,1,1,,,,,,,,,,,,,,,,,,,,,,,,
2733,"Medtronic, Inc. v. Boston Scientific Corp.",6 Fed.Appx. 890,61 U.S.P.Q.2d 1447,23/4/2001,1,1,,5653727,A61F2/88,0,0,,,,,,,,,,,,,,,,,,,,,,,,
2734,"Somfy, S.A. v. Springs Window Fashions Div., Inc.",6 Fed.Appx. 895,2001 WL 424834,25/4/2001,1,1,,5328113,E06B9/308,0,0,,,,,,,,,,,,,,,,,,,,,,,,
2736,"Reese v. U.S. West, Inc.",60 Fed.Appx. 274,2003 WL 859234,5/3/2003,1,1,,5619561,H04M3/56,0,0,,,,,,,,,,,,,,,,,,,,,,,,
2737,"KIS, S.A. v. Foto Fantasy, Inc.",60 Fed.Appx. 319,2003 WL 722181,28/2/2003,1,1,,5539453,H04N1/00286,1,1,,,,,,,,,,,,,,,,,,,,,,,,
2738,"Display Technologies, Inc. v. Paul Flum Ideas, Inc.",60 Fed.Appx. 787,2002 WL 32066815,4/3/2002,1,1,,5646176,C07D407/12,0,0,,,,,,,,,,,,,,,,,,,,,,,,
2739,Caputo v. Sealed Air Corp. (US),60 Fed.Appx. 822,2003 WL 1827223,8/4/2003,1,1,,4579516,B29C51/225,0,0,,,,,,,,,,,,,,,,,,,,,,,,
2742,"Bid for Position, LLC v. AOL, LLC",601 F.3d 1311,94 U.S.P.Q.2d 1368,7/4/2010,1,1,,7225151,G06Q30/08,0,0,,,,,,,,,,,,,,,,,,,,,,,,
2744,"Anascape, Ltd. v. Nintendo of America Inc.",601 F.3d 1333,94 U.S.P.Q.2d 1627,13/4/2010,1,2,,6906700,G05G9/04737,1,1,6222525,H01H13/785,1,1,,,,,,,,,,,,,,,,,,,,
2748,"Bradford Co. v. Conteyor North America, Inc.",603 F.3d 1262,94 U.S.P.Q.2d 1917,29/4/2010,1,2,,6230916,B65D19/44,1,1,6540096,B65D1/225,1,1,,,,,,,,,,,,,,,,,,,,
2750,"Rolls-Royce, PLC v. United Technologies Corp.",603 F.3d 1325,95 U.S.P.Q.2d 1097,5/5/2010,1,1,,6071077,F04D29/324,0,0,,,,,,,,,,,,,,,,,,,,,,,,
2758,Haemonetics Corp. v. Baxter Healthcare Corp.,607 F.3d 776,95 U.S.P.Q.2d 1556,2/6/2010,1,1,,6705983,B04B5/0442,1,1,,,,,,,,,,,,,,,,,,,,,,,,
2759,"Silicon Graphics, Inc. v. ATI Technologies, Inc.",607 F.3d 784,95 U.S.P.Q.2d 1417,4/6/2010,1,1,,6650327,G06T15/405,1,1,,,,,,,,,,,,,,,,,,,,,,,,
2765,Xerox Corp. v. 3Com Corp.,61 Fed.Appx. 680,66 U.S.P.Q.2d 1216,20/2/2003,1,1,,5596656,G06F3/04883,0,0,,,,,,,,,,,,,,,,,,,,,,,,
2767,"Telcordia Technologies, Inc. v. Cisco Systems, Inc.",612 F.3d 1365,95 U.S.P.Q.2d 1673,6/7/2010,1,1,,4893306,H04J3/1682,1,1,,,,,,,,,,,,,,,,,,,,,,,,
2768,"Enovsys LLC v. Nextel Communications, Inc.",614 F.3d 1333,95 U.S.P.Q.2d 1947,3/8/2010,1,2,Judge Newman dissented,5918159,H04W84/025,0,0,6560461,H04W84/022,0,0,,,,,,,,,,,,,,,,,,,,
