case_id,case_title,case_citation,parallel_cite,filed_date,not_rule36,number_of_patents,note,patent1,patent1_cpc,patent1_find_error,patent1_reverse,patent2,patent2_cpc,patent2_find_error,patent2_reverse,patent3,patent3_cpc,patent3_find_error,patent3_reverse,patent4,patent4_cpc,patent4_find_error,patent4_reverse,patent5,patent5_cpc,patent5_find_error,patent5_reverse,patent6,patent6_cpc,patent6_find_error,patent6_reverse,patent7,patent7_cpc,patent7_find_error,patent7_reverse
1547,"ASM America, Inc. v. Genus, Inc.",401 F.3d 1340,74 U.S.P.Q.2d 1211,16/3/2005,1,2,,6015590,C23C16/45525,0,0,5916365,C23C16/45542,0,0,,,,,,,,,,,,,,,,,,,,
1548,"Howmedica Osteonics Corp. v. Tranquil Prospects, Ltd.",401 F.3d 1367,74 U.S.P.Q.2d 1680,28/3/2005,1,1,,5222985,A61F2/30907,1,1,,,,,,,,,,,,,,,,,,,,,,,,
1552,"Asyst Technologies, Inc. v. Emtrak, Inc.",402 F.3d 1188,74 U.S.P.Q.2d 1272,22/3/2005,1,1,,5097421,H01L21/67294,1,1,,,,,,,,,,,,,,,,,,,,,,,,
1554,"Nellcor Puritan Bennett, Inc. v. Masimo Corp.",402 F.3d 1364,74 U.S.P.Q.2d 1351,8/4/2005,1,1,,4934372,A61B5/301,1,1,,,,,,,,,,,,,,,,,,,,,,,,
1555,"Chimie v. PPG Industries, Inc.",402 F.3d 1371,61 Fed.R.Serv.3d 724,11/4/2005,1,1,,6013234,C09C1/42,0,0,,,,,,,,,,,,,,,,,,,,,,,,
1561,SmithKline Beecham Corp. v. Apotex Corp.,403 F.3d 1331,74 U.S.P.Q.2d 1398,8/4/2005,1,1,,4721723,C07D405/12,1,0,,,,,,,,,,,,,,,,,,,,,,,,
1562,"Nazomi Communications, Inc. v. Arm Holdings, PLC",403 F.3d 1364,74 U.S.P.Q.2d 1458,11/4/2005,1,1,,6332215,G06F9/30174,1,1,,,,,,,,,,,,,,,,,,,,,,,,
1577,Hoffer v. Microsoft Corp.,405 F.3d 1326,74 U.S.P.Q.2d 1481,22/4/2005,1,1,,5799151,G06Q30/06,0,0,,,,,,,,,,,,,,,,,,,,,,,,
1578,"Gillette Co. v. Energizer Holdings, Inc.",405 F.3d 1367,74 U.S.P.Q.2d 1586,29/4/2005,1,1,Judge Archer dissented,6212777,B26B21/4031,1,1,,,,,,,,,,,,,,,,,,,,,,,,
1585,PC Connector Solutions LLC v. SmartDisk Corp.,406 F.3d 1359,74 U.S.P.Q.2d 1698,6/5/2005,1,1,,5224216,G11B23/0327,0,0,,,,,,,,,,,,,,,,,,,,,,,,
1587,"Group One, Ltd. v. Hallmark Cards, Inc.",407 F.3d 1297,74 U.S.P.Q.2d 1759,16/5/2005,1,2,,5518492,D04D9/06,0,0,5711752,D04D9/06,0,0,,,,,,,,,,,,,,,,,,,,
1588,"Syntex (U.S.A.) LLC v. Apotex, Inc.",407 F.3d 1371,74 U.S.P.Q.2d 1823,18/5/2005,1,1,,5110493,A61K9/0048,0,0,,,,,,,,,,,,,,,,,,,,,,,,
1606,"Edberg v. CPI-The Alternative Supplier, Inc.",41 Fed.Appx. 426,2002 WL 1541688,15/7/2002,1,2,,5780259,C12Q1/045,0,0,5429933,C12Q1/045,0,0,,,,,,,,,,,,,,,,,,,,
1607,"Neupak, Inc. v. Ideal Mfg. and Sales Corp.",41 Fed.Appx. 435,2002 WL 1363568,24/6/2002,1,1,,5505233,B65B39/00,0,0,,,,,,,,,,,,,,,,,,,,,,,,
1608,"Boss Control, Inc. v. Bombardier Inc.",410 F.3d 1372,75 U.S.P.Q.2d 1038,8/6/2005,1,1,,5734206,G07C9/33,0,0,,,,,,,,,,,,,,,,,,,,,,,,
1610,"Air Turbine Technology, Inc. v. Atlas Copco AB",410 F.3d 701,"2005-1 Trade Cases P 74,839",7/6/2005,1,1,,5439346,F01D15/065,0,0,,,,,,,,,,,,,,,,,,,,,,,,
1621,"Ultra-Precision Mfg., Ltd. v. Ford Motor Co.",411 F.3d 1369,75 U.S.P.Q.2d 1065,15/6/2005,1,1,,5236312,F04B27/12,0,0,,,,,,,,,,,,,,,,,,,,,,,,
1624,"Prima Tek II, L.L.C. v. Polypap, S.A.R.L.",412 F.3d 1284,75 U.S.P.Q.2d 1219,22/6/2005,1,2,,5410856,G09F23/00,1,1,5615532,A01M1/02,1,1,,,,,,,,,,,,,,,,,,,,
1625,"Default Proof Credit Card System, Inc. v. Home Depot U.S.A., Inc. (d/b/a The Home Depot)",412 F.3d 1291,75 U.S.P.Q.2d 1116,16/6/2005,1,1,,6405182,G06Q20/02,0,0,,,,,,,,,,,,,,,,,,,,,,,,
1627,"Sunbeam Products, Inc. v. HoMedics, Inc.",412 Fed.Appx. 263,2010 WL 5230892,15/12/2010,1,1,,5133420,G01G19/42,0,0,,,,,,,,,,,,,,,,,,,,,,,,
1628,"St. Clair Intellectual Property Consultants, Inc. v. Canon Inc.",412 Fed.Appx. 270,2011 WL 66166,10/1/2011,1,4,"MOORE, Circuit Judge, dissenting.",5138459,H04N1/00241,1,1,6094219,H04N1/00241,1,1,6233010,H04N1/00241,1,1,6323899,H04N1/00241,1,1,,,,,,,,,,,,
1636,"Seachange Intern., Inc. v. C-COR, Inc.",413 F.3d 1361,75 U.S.P.Q.2d 1385,29/6/2005,1,1,,5862312,G06F11/2028,1,1,,,,,,,,,,,,,,,,,,,,,,,,
1641,"Altair Engineering, Inc. v. LEDdynamics, Inc.",413 Fed.Appx. 251,2011 WL 836440,9/3/2011,1,1,,7049761,H05B47/10,0,0,,,,,,,,,,,,,,,,,,,,,,,,
1642,"Move, Inc. v. Real Estate Alliance Ltd.",413 Fed.Appx. 280,2011 WL 995939,22/3/2011,1,1,,5032989,G06Q50/16,1,1,,,,,,,,,,,,,,,,,,,,,,,,
1643,Salazar v. Procter & Gamble Co.,414 F.3d 1342,75 U.S.P.Q.2d 1369,8/7/2005,1,1,,5535474,A46B15/0032,1,1,,,,,,,,,,,,,,,,,,,,,,,,
1645,"Alcohol Monitoring Systems, Inc. v. Actsoft, Inc.",414 Fed.Appx. 294,2011 WL 201494,24/1/2011,1,1,,5220919,G01N33/4972,1,1,,,,,,,,,,,,,,,,,,,,,,,,
1646,"SanDisk Corp. v. Memorex Products, Inc.",415 F.3d 1278,75 U.S.P.Q.2d 1475,8/7/2005,1,1,,5602987,G11C29/26,1,1,,,,,,,,,,,,,,,,,,,,,,,,
1647,Phillips v. AWH Corp.,415 F.3d 1303,75 U.S.P.Q.2d 1321,12/7/2005,1,1,,4677798,E04H9/10,1,1,,,,,,,,,,,,,,,,,,,,,,,,
1648,"North American Container, Inc. v. Plastipak Packaging, Inc.",415 F.3d 1335,75 U.S.P.Q.2d 1545,14/7/2005,1,1,,RE36639,,1,1,,,,,,,,,,,,,,,,,,,,,,,,
1649,"Warsaw Orthopedic, Inc. v. Globus Medical, Inc.",416 Fed.Appx. 67,2011 WL 229563,26/1/2011,1,2,,6530929,A61B17/7086,0,0,7008422,A61B17/7086,0,0,,,,,,,,,,,,,,,,,,,,
1650,Fifth Generation Computer Corp. v. International Business Machines Corp.,416 Fed.Appx. 74,2011 WL 229575,26/1/2011,1,1,,6000024,G06F15/8023,0,0,,,,,,,,,,,,,,,,,,,,,,,,
1654,Harris Corp. v. Ericsson Inc.,417 F.3d 1241,75 U.S.P.Q.2d 1705,5/8/2005,1,1,,4365338,H03H21/0012,1,1,,,,,,,,,,,,,,,,,,,,,,,,
1655,"Datamize, LLC v. Plumtree Software, Inc.",417 F.3d 1342,75 U.S.P.Q.2d 1801,5/8/2005,1,1,,6014137,G06F3/04842,0,0,,,,,,,,,,,,,,,,,,,,,,,,
1663,"CollegeNet, Inc. v. ApplyYourself, Inc.",418 F.3d 1225,75 U.S.P.Q.2d 1733,2/8/2005,1,2,,6345278,G06F40/174,0,0,6460042,G06F40/174,1,1,,,,,,,,,,,,,,,,,,,,
1664,"NTP, Inc. v. Research In Motion, Ltd.",418 F.3d 1282,75 U.S.P.Q.2d 1763,2/8/2005,1,5,,5436960,H04L51/56,1,1,5625670,H04L51/56,1,1,5819172,H04L51/56,0,0,6067451,H04L51/56,0,0,6317592,H04L51/56,1,1,,,,,,,,
1665,"Warner-Lambert Co. v. Teva Pharmaceuticals USA, Inc.",418 F.3d 1326,75 U.S.P.Q.2d 1865,11/8/2005,1,1,,4743450,A61K31/40,0,0,,,,,,,,,,,,,,,,,,,,,,,,
1667,Terlep v. Brinkmann Corp.,418 F.3d 1379,76 U.S.P.Q.2d 1053,16/8/2005,1,1,,5594433,E01F13/02,0,0,,,,,,,,,,,,,,,,,,,,,,,,
1669,Sanders v. The Mosaic Co.,418 Fed.Appx. 914,2011 WL 1491248,20/4/2011,1,1,,6210459,C05C3/00,1,1,,,,,,,,,,,,,,,,,,,,,,,,
1680,"Pause Technology, LLC v. TiVo, Inc.",419 F.3d 1326,76 U.S.P.Q.2d 1110,16/8/2005,1,1,,RE36801,,0,0,,,,,,,,,,,,,,,,,,,,,,,,
1681,"Tap Pharmaceutical Products, Inc. v. Owl Pharmaceuticals, L.L.C.",419 F.3d 1346,76 U.S.P.Q.2d 1126,18/8/2005,1,5,,5476663,A61K9/5031,0,0,5631020,A61K9/5031,0,0,5631021,A61K9/5031,0,0,4728721,C08G63/06,0,0,4849228,C08G63/06,0,0,,,,,,,,
1682,"AquaTex Industries, Inc. v. Techniche Solutions",419 F.3d 1374,76 U.S.P.Q.2d 1213,19/8/2005,1,0,,6371977,F41H5/0471,1,1,,,,,,,,,,,,,,,,,,,,,,,,
1693,"Research Plastics, Inc. v. Federal Packaging Corp.",421 F.3d 1290,76 U.S.P.Q.2d 1133,18/8/2005,1,1,,5628433,B05C17/00579,1,1,,,,,,,,,,,,,,,,,,,,,,,,
1697,"Network Commerce, Inc. v. Microsoft Corp.",422 F.3d 1353,76 U.S.P.Q.2d 1330,8/9/2005,1,1,,6073124,G07F17/0014,1,0,,,,,,,,,,,,,,,,,,,,,,,,
1700,"Biagro Western Sales, Inc. v. Grow More, Inc.",423 F.3d 1296,76 U.S.P.Q.2d 1347,13/9/2005,1,1,,5830255,C05G5/23,0,0,,,,,,,,,,,,,,,,,,,,,,,,
1702,"Free Motion Fitness, Inc. v. Cybex Intern., Inc.",423 F.3d 1343,76 U.S.P.Q.2d 1432,16/9/2005,1,2,,6238323,A63B21/156,1,1,6458061,A63B21/156,1,1,,,,,,,,,,,,,,,,,,,,
1709,"Nystrom v. TREX Co., Inc.",424 F.3d 1136,76 U.S.P.Q.2d 1481,14/9/2005,1,1,,5474831,E04F15/04,1,1,,,,,,,,,,,,,,,,,,,,,,,,
1711,"CytoLogix Corp. v. Ventana Medical Systems, Inc.",424 F.3d 1168,76 U.S.P.Q.2d 1592,21/9/2005,1,1,,6180061,F04B23/025,1,0,,,,,,,,,,,,,,,,,,,,,,,,
1712,"Cross Medical Products, Inc. v. Medtronic Sofamor Danek, Inc.",424 F.3d 1293,76 U.S.P.Q.2d 1662,30/9/2005,1,1,,5474555,A61B17/7037,1,1,,,,,,,,,,,,,,,,,,,,,,,,
1713,"JVW Enterprises, Inc. v. Interact Accessories, Inc.",424 F.3d 1324,76 U.S.P.Q.2d 1641,3/10/2005,1,1,,4494754,A63F13/02,1,1,,,,,,,,,,,,,,,,,,,,,,,,
1727,"Callicrate v. Wadsworth Mfg., Inc.",427 F.3d 1361,77 U.S.P.Q.2d 1041,31/10/2005,1,2,,5997553,A61B17/12009,1,0,5681329,A61B17/12009,1,0,,,,,,,,,,,,,,,,,,,,
1733,"Dorel Juvenile Group, Inc. v. Graco Children's Products, Inc.",429 F.3d 1043,77 U.S.P.Q.2d 1090,7/11/2005,1,2,Judge Newman dissents regarding claim construction,6550862,B60N2/286,0,0,6612649,B60N2/286,0,0,,,,,,,,,,,,,,,,,,,,
1734,"Invitrogen Corp. v. Clontech Laboratories, Inc.",429 F.3d 1052,77 U.S.P.Q.2d 1161,18/11/2005,1,1,,6063608,C12P19/34,0,0,,,,,,,,,,,,,,,,,,,,,,,,
1735,"MicroStrategy Inc. v. Business Objects, S.A.",429 F.3d 1344,77 U.S.P.Q.2d 1001,17/11/2005,1,2,,6260050,H04L69/329,0,0,6270033,B65H63/036,0,0,,,,,,,,,,,,,,,,,,,,
1736,"Pfizer, Inc. v. Teva Pharmaceuticals, USA, Inc.",429 F.3d 1364,77 U.S.P.Q.2d 1257,22/11/2005,1,1,,4743450,A61K31/40,0,0,,,,,,,,,,,,,,,,,,,,,,,,
1741,"REckitt Benckiser Inc. v. Watson Laboratories, Inc.",430 Fed.Appx. 871,2011 WL 2648723,7/7/2011,1,1,,6372252,A61K9/5084,0,0,,,,,,,,,,,,,,,,,,,,,,,,
1744,"Kimberly-Clark Worldwide, Inc. v. First Quality Baby Products, LLC",431 Fed.Appx. 884,2011 WL 2161072,1/6/2011,1,2,,7156939,A61F13/15747,1,1,6888143,A61F13/15,1,1,,,,,,,,,,,,,,,,,,,,
1745,"ImageCube, LLC v. The Boeing Co.",431 Fed.Appx. 905,2011 WL 2438634,20/6/2011,1,1,,RE37875,,0,0,,,,,,,,,,,,,,,,,,,,,,,,
1747,Norian Corp. v. Stryker Corp.,432 F.3d 1356,77 U.S.P.Q.2d 1242,6/12/2005,1,1,,6002065,A61L24/02,0,0,,,,,,,,,,,,,,,,,,,,,,,,
1759,"Aerotel, Ltd. v. Telco Group, Inc.",433 Fed.Appx. 903,2011 WL 3100334,26/7/2011,1,1,,4706275,H04M17/023,1,1,,,,,,,,,,,,,,,,,,,,,,,,
1766,"Mitsubishi Chemical Corp. v. Barr Laboratories, Inc.",435 Fed.Appx. 927,2011 WL 3288394,2/8/2011,1,1,,5214052,A61K9/0019,0,0,,,,,,,,,,,,,,,,,,,,,,,,
1767,"Privacash, Inc. v. American Exp. Co.",435 Fed.Appx. 939,2011 WL 3510742,11/8/2011,1,1,,7328181,G06Q20/385,0,0,,,,,,,,,,,,,,,,,,,,,,,,
1768,"nCube Corp. v. Seachange Intern., Inc.",436 F.3d 1317,77 U.S.P.Q.2d 1481,9/1/2006,1,1,,5805804,H04L65/612,0,0,,,,,,,,,,,,,,,,,,,,,,,,
1769,"Varco, L.P. v. Pason Systems USA Corp.",436 F.3d 1368,77 U.S.P.Q.2d 1948,1/2/2006,1,1,,5474142,E21B44/02,1,1,,,,,,,,,,,,,,,,,,,,,,,,
1775,"Stamps.com Inc. v. Endicia, Inc.",437 Fed.Appx. 897,2011 WL 2417044,15/6/2011,1,3,,5717597,G07B17/00508,1,0,6208980,G07B17/00508,1,0,6982808,G07B17/00508,1,0,,,,,,,,,,,,,,,,
1777,Joovy LLC v. Target Corp.,437 Fed.Appx. 932,2011 WL 3416514,5/8/2011,1,1,,5622375,B62B9/28,1,1,,,,,,,,,,,,,,,,,,,,,,,,
1778,Purdue Pharma L.P. v. Endo Pharmaceuticals Inc.,438 F.3d 1123,77 U.S.P.Q.2d 1767,1/2/2006,1,3,5656295 and 5508042 are the related continuations of 5549912,5656295,A61K9/2013,1,1,5508042,A61K9/2013,1,1,5549912,A61K9/2013,1,1,,,,,,,,,,,,,,,,
1780,"Curtiss-Wright Flow Control Corp. v. Velan, Inc.",438 F.3d 1374,77 U.S.P.Q.2d 1988,15/2/2006,1,1,,6565714,C10B25/10,1,1,,,,,,,,,,,,,,,,,,,,,,,,
1789,SmithKline Beecham Corp. v. Apotex Corp.,439 F.3d 1312,78 U.S.P.Q.2d 1097,24/2/2006,1,2,Judge Newman dissents regarding claim construction,6113944,A61K9/2095,0,0,4721723,C07D405/12,0,0,,,,,,,,,,,,,,,,,,,,
1793,"Semitool, Inc. v. Novellus Systems, Inc.",44 Fed.Appx. 949,2002 WL 1628368,23/7/2002,1,2,,5222310,H01L21/68728,0,0,5337708,F02D33/003,0,0,,,,,,,,,,,,,,,,,,,,
1794,"Laporte Pigments, Inc. v. Axel J., LP",44 Fed.Appx. 960,2002 WL 1890749,15/8/2002,1,1,,4946505,C04B14/022,1,0,,,,,,,,,,,,,,,,,,,,,,,,
1795,"Schoenhaus v. Genesco, Inc.",440 F.3d 1354,78 U.S.P.Q.2d 1252,15/3/2006,1,1,,5174052,A43B7/1425,0,0,,,,,,,,,,,,,,,,,,,,,,,,
1799,"Bicon, Inc. v. Straumann Co.",441 F.3d 945,78 U.S.P.Q.2d 1267,20/3/2006,1,1,,5749731,A61C8/00,0,0,,,,,,,,,,,,,,,,,,,,,,,,
1801,Atofina v. Great Lakes Chemical Corp.,441 F.3d 991,78 U.S.P.Q.2d 1417,23/3/2006,1,1,,5900514,C07C17/206,0,0,,,,,,,,,,,,,,,,,,,,,,,,
1809,"Exigent Technology, Inc. v. Atrana Solutions, Inc.",442 F.3d 1301,64 Fed.R.Serv.3d 433,22/3/2006,1,1,,6651885,G06Q20/04,0,0,,,,,,,,,,,,,,,,,,,,,,,,
1810,Wilson Sporting Goods Co. v. Hillerich & Bradsby Co.,442 F.3d 1322,78 U.S.P.Q.2d 1382,23/3/2006,1,1,,5415398,A63B59/51,1,1,,,,,,,,,,,,,,,,,,,,,,,,
1811,"On Demand Machine Corp. v. Ingram Industries, Inc.",442 F.3d 1331,78 U.S.P.Q.2d 1428,31/3/2006,1,1,,5465213,G06Q30/02,1,1,,,,,,,,,,,,,,,,,,,,,,,,
1814,"Semitool, Inc. v. Dynamic Micro Systems Semiconductor Equipment GmbH",444 F.3d 1337,78 U.S.P.Q.2d 1438,6/4/2006,1,3,,5562113,H01L21/67017,0,0,5738128,H01L21/67017,0,0,5972127,H01L21/67017,0,0,,,,,,,,,,,,,,,,
1817,"Lava Trading, Inc. v. Sonic Trading Management, LLC",445 F.3d 1348,78 U.S.P.Q.2d 1624,19/4/2006,1,1,,6278982,G06Q40/04,1,1,,,,,,,,,,,,,,,,,,,,,,,,
1818,"Bruckelmyer v. Ground Heaters, Inc.",445 F.3d 1374,78 U.S.P.Q.2d 1684,20/4/2006,1,2,,5567085,E02D27/35,0,0,,,,,,,,,,,,,,,,,,,,,,,,
1831,"Fuzzysharp Technologies Inc. v. 3DLabs Inc., Ltd.",447 Fed.Appx. 182,2011 WL 5248297,4/11/2011,1,2,district court failed to construct,6172679,G06T15/40,1,1,6618047,G06T15/40,1,1,,,,,,,,,,,,,,,,,,,,
1832,Old Town Canoe Co. v. Confluence Holdings Corp.,448 F.3d 1309,78 U.S.P.Q.2d 1705,9/5/2006,1,1,,4836963,B29C41/22,0,0,,,,,,,,,,,,,,,,,,,,,,,,
1833,Applied Medical Resources Corp. v. U.S. Surgical Corp.,448 F.3d 1324,78 U.S.P.Q.2d 1807,15/5/2006,1,1,,5385553,A61M39/06,1,1,,,,,,,,,,,,,,,,,,,,,,,,
1845,"Inpro II Licensing, S.A.R.L. v. T-Mobile USA, Inc.",450 F.3d 1350,78 U.S.P.Q.2d 1786,11/5/2006,1,1,,6523079,G06Q30/0601,0,0,,,,,,,,,,,,,,,,,,,,,,,,
1846,Agfa Corp. v. Creo Products Inc.,451 F.3d 1366,79 U.S.P.Q.2d 1385,26/6/2006,1,1,Judge Newman dissents regarding claim construction,5655452,B65H3/0816,0,0,,,,,,,,,,,,,,,,,,,,,,,,
1847,Panduit Corp. v. HellermannTyton Corp.,451 F.3d 819,79 U.S.P.Q.2d 1053,12/6/2006,1,1,,5998732,H02G3/105,0,0,,,,,,,,,,,,,,,,,,,,,,,,
1848,"Primos, Inc. v. Hunter's Specialties, Inc.",451 F.3d 841,79 U.S.P.Q.2d 1129,14/6/2006,1,1,,5520567,A01M31/06,0,0,,,,,,,,,,,,,,,,,,,,,,,,
1849,Yoon Ja Kim v. Earthgrains Co.,451 Fed.Appx. 922,2011 WL 6118496,9/12/2011,1,1,,RE36355,,0,0,,,,,,,,,,,,,,,,,,,,,,,,
1858,"Honeywell Intern., Inc. v. ITT Industries, Inc.",452 F.3d 1312,79 U.S.P.Q.2d 1294,22/6/2006,1,1,,5164879,B01D27/08,1,0,,,,,,,,,,,,,,,,,,,,,,,,
1860,"Zircon Corp. v. Stanley Black & Decker, Inc.",452 Fed.Appx. 966,2011 WL 4590392,5/10/2011,1,1,,7116091,G01V3/088,0,0,,,,,,,,,,,,,,,,,,,,,,,,
1862,"Roche Diagnostics Operations, Inc. v. Lifescan Inc.",452 Fed.Appx. 989,2012 WL 572851,25/1/2012,1,2,,7276146,C12Q1/001,0,0,7276147,G01N27/3272,0,0,,,,,,,,,,,,,,,,,,,,
1863,"LG Electronics, Inc. v. Bizcom Electronics, Inc.",453 F.3d 1364,79 U.S.P.Q.2d 1443,7/7/2006,1,4,,4918645,G11C8/12,1,1,4939641,G06F12/0833,1,1,5379379,G06F13/1631,1,1,5892509,G06F3/0488,1,1,,,,,,,,,,,,
1865,"Smith & Nephew, Inc. v. Arthrex, Inc.",453 Fed.Appx. 977,2011 WL 2438633,20/6/2011,1,1,,5645588,A61F2/0805,0,0,,,,,,,,,,,,,,,,,,,,,,,,
1869,"Flex-Rest, LLC v. Steelcase, Inc.",455 F.3d 1351,80 U.S.P.Q.2d 1620,13/7/2006,1,2,,5709489,A47B21/0314,0,0,5961231,A47B21/0371,0,0,,,,,,,,,,,,,,,,,,,,
1874,"ICHL, LLC v. Sony Electronics, Inc.",455 Fed.Appx. 978,2011 WL 6415043,22/12/2011,1,1,,4884631,F28F3/02,0,0,,,,,,,,,,,,,,,,,,,,,,,,
1876,"Pfizer, Inc. v. Ranbaxy Laboratories Ltd.",457 F.3d 1284,79 U.S.P.Q.2d 1583,2/8/2006,1,2,,4681893,C07D405/06,0,0,5273995,C07D405/06,0,0,,,,,,,,,,,,,,,,,,,,
1877,"Amgen Inc. v. Hoechst Marion Roussel, Inc.",457 F.3d 1293,79 U.S.P.Q.2d 1705,3/8/2006,1,1,,5955422,C07K14/505,1,1,,,,,,,,,,,,,,,,,,,,,,,,
1878,Xerox Corp. v. 3Com Corp.,458 F.3d 1310,80 U.S.P.Q.2d 1916,8/6/2006,1,1,,5596656,G06F3/04883,1,1,,,,,,,,,,,,,,,,,,,,,,,,
1880,"Serio-US Industries, Inc. v. Plastic Recovery Technologies Corp.",459 F.3d 1311,80 U.S.P.Q.2d 1065,10/8/2006,1,2,,5094358,E05B15/0093,0,0,5662364,B65F1/1615,0,0,,,,,,,,,,,,,,,,,,,,
1882,"North American Oil Co., Inc. v. Star Brite Distributing, Inc.",46 Fed.Appx. 629,2002 WL 31060488,17/9/2002,1,1,,5250598,C09D127/06,1,1,,,,,,,,,,,,,,,,,,,,,,,,
1883,"Advanced Communication Design, Inc. v. Premier Retail Networks, Inc.",46 Fed.Appx. 964,2002 WL 31108793,23/9/2002,1,1,,6133908,G07F17/305,1,1,,,,,,,,,,,,,,,,,,,,,,,,
1884,"Conoco, Inc. v. Energy & Environmental Intern., L.C.",460 F.3d 1349,79 U.S.P.Q.2d 1801,17/8/2006,1,2,,5244937,F17D1/17,0,0,6172151,C09K3/00,0,0,,,,,,,,,,,,,,,,,,,,
1885,"Cook Biotech Inc. v. Acell, Inc.",460 F.3d 1365,79 U.S.P.Q.2d 1865,18/8/2006,1,1,,5554389,A61L27/3683,1,1,,,,,,,,,,,,,,,,,,,,,,,,
1886,"Marshall Patent Holdings, LLC v. U.S. South Communications, Inc.",461 Fed.Appx. 926,2011 WL 7461074,9/11/2011,1,2,It is an order without patent number,5790636,H04M15/745,0,0,6295344,H04M15/745,0,0,,,,,,,,,,,,,,,,,,,,
1890,"Massachusetts Institute of Technology and Electronics For Imaging, Inc. v. Abacus Software",462 F.3d 1344,80 U.S.P.Q.2d 1225,13/9/2006,1,1,Judge Michel dissents regarding claim construction,4500919,H04N1/6005,1,1,,,,,,,,,,,,,,,,,,,,,,,,
1891,"Ormco Corp. v. Align Technology, Inc.",463 F.3d 1299,79 U.S.P.Q.2d 1931,30/8/2006,1,2,,6554611,A61C7/00,1,1,6398548,A61C7/08,1,1,,,,,,,,,,,,,,,,,,,,
1898,"Alza Corp. v. Mylan Laboratories, Inc.",464 F.3d 1286,80 U.S.P.Q.2d 1001,6/9/2006,1,1,,6124355,A61K9/0004,0,0,,,,,,,,,,,,,,,,,,,,,,,,
1909,"Yoon Ja Kim v. ConAgra Foods, Inc.",465 F.3d 1312,80 U.S.P.Q.2d 1495,20/9/2006,1,1,,RE36355,,0,0,,,,,,,,,,,,,,,,,,,,,,,,
1910,"SRAM Corp. v. AD-II Engineering, Inc.",465 F.3d 1351,80 U.S.P.Q.2d 1363,2/10/2006,1,1,,4900291,G05G7/02,1,1,,,,,,,,,,,,,,,,,,,,,,,,
1911,"Medtronic, Inc. v. Guidant Corp.",465 F.3d 1360,80 U.S.P.Q.2d 1558,12/10/2006,1,1,,RE38119,,0,0,,,,,,,,,,,,,,,,,,,,,,,,
1916,"Aero Products Intern., Inc. v. Intex Recreation Corp.",466 F.3d 1000,80 U.S.P.Q.2d 1481,2/10/2006,1,1,,5367726,A47C27/081,0,0,,,,,,,,,,,,,,,,,,,,,,,,
1934,"O2 Micro Intern. Ltd. v. Monolithic Power Systems, Inc.",467 F.3d 1355,80 U.S.P.Q.2d 1769,15/11/2006,1,1,,5634550,B65G17/08,1,1,,,,,,,,,,,,,,,,,,,,,,,,
1935,"Abraxis Bioscience, Inc. v. Mayne Pharma (USA) Inc.",467 F.3d 1370,80 U.S.P.Q.2d 1705,15/11/2006,1,3,,5714520,A61K31/05,1,1,5731355,A61K9/1075,1,1,5731356,A61K9/1075,1,1,,,,,,,,,,,,,,,,
1958,"Impax Laboratories, Inc. v. Aventis Pharmaceuticals Inc.",468 F.3d 1366,81 U.S.P.Q.2d 1001,20/11/2006,1,1,,5527814,A61K31/425,0,0,,,,,,,,,,,,,,,,,,,,,,,,
1973,"DePuy Spine, Inc. v. Medtronic Sofamor Danek, Inc.",469 F.3d 1005,80 U.S.P.Q.2d 1865,20/11/2006,1,1,,5207678,A61B17/7037,1,1,,,,,,,,,,,,,,,,,,,,,,,,
1976,"Optivus Technology, Inc. v. Ion Beam Applications S.A.",469 F.3d 978,80 U.S.P.Q.2d 1839,16/11/2006,1,2,,4870287,A61N5/1079,0,0,,,,,,,,,,,,,,,,,,,,,,,,
1985,"Learning Curve Brands v. Munchkin, Inc.",469 Fed.Appx. 908,2012 WL 1326679,30/3/2012,1,1,,7185784,A47G19/2272,0,0,,,,,,,,,,,,,,,,,,,,,,,,
1995,Eastman Chemical Co. v. Aktiengesellschaft,47 Fed.Appx. 566,2002 WL 31085363,17/9/2002,1,1,,5118856,C07C45/676,0,0,,,,,,,,,,,,,,,,,,,,,,,,
1996,"Zevo Golf Co., Inc. v. Karsten Mfg. Corp.",47 Fed.Appx. 933,2002 WL 31175474,1/10/2002,1,1,,5851155,A63B53/02,0,0,,,,,,,,,,,,,,,,,,,,,,,,
2010,"DSU Medical Corp. v. JMS Co., Ltd.",471 F.3d 1293,81 U.S.P.Q.2d 1238,13/12/2006,1,1,,5112311,A61M25/0637,0,0,,,,,,,,,,,,,,,,,,,,,,,,
2011,"L & W, Inc. v. Shertech, Inc.",471 F.3d 1311,67 Fed.R.Serv.3d 156,14/12/2006,1,1,,5670264,E04B1/78,0,0,,,,,,,,,,,,,,,,,,,,,,,,
2012,"Abbott Laboratories v. Baxter Pharmaceutical Products, Inc.",471 F.3d 1363,80 U.S.P.Q.2d 1860,9/11/2006,1,1,,5990176,A61K47/02,1,1,,,,,,,,,,,,,,,,,,,,,,,,
2020,"Planet Bingo, LLC v. GameTech Intern., Inc.",472 F.3d 1338,81 U.S.P.Q.2d 1145,13/12/2006,1,2,,5482289,A63F3/0645,0,0,5727786,A63F3/0645,0,0,,,,,,,,,,,,,,,,,,,,
2022,"Ventana Medical Systems, Inc. v. Biogenex Laboratories, Inc.",473 F.3d 1173,81 U.S.P.Q.2d 1314,29/12/2006,1,1,Judge Lourie dissented,6352861,G01N35/10,1,1,,,,,,,,,,,,,,,,,,,,,,,,
2023,"Abbott Laboratories v. Andrx Pharmaceuticals, Inc.",473 F.3d 1196,81 U.S.P.Q.2d 1289,5/1/2007,1,2,,6010718,A61K31/7048,0,0,6551616,A61K31/7048,0,0,,,,,,,,,,,,,,,,,,,,
2024,"E-Pass Technologies, Inc. v. 3Com Corp",473 F.3d 1213,81 U.S.P.Q.2d 1385,12/1/2007,1,1,,5276311,G07F7/1008,1,0,,,,,,,,,,,,,,,,,,,,,,,,
2025,"Sanofi-Aventis Deutschland GmbH v. Genentech, Inc.",473 Fed.Appx. 885,2012 WL 1178059,22/3/2012,1,2,,5849522,C12N15/85,0,0,6218140,C12N15/85,0,0,,,,,,,,,,,,,,,,,,,,
2033,"MBO Laboratories, Inc. v. Becton, Dickinson & Co.",474 F.3d 1323,81 U.S.P.Q.2d 1661,24/1/2007,1,1,,RE36885,,1,1,,,,,,,,,,,,,,,,,,,,,,,,
2034,"Andersen Corp. v. Fiber Composites, LLC",474 F.3d 1361,81 U.S.P.Q.2d 1545,26/1/2007,1,6,,5827607,C08L97/02,0,0,5932334,C08L97/02,0,0,6015611,C08L97/02,0,0,6015612,C08L97/02,0,0,5486533,C07D231/12,1,1,5539027,C08J5/045,1,1,,,,
2046,"Ortho-McNeil Pharmaceutical, Inc. v. Caraco Pharmaceutical Laboratories, Ltd.",476 F.3d 1321,81 U.S.P.Q.2d 1427,19/1/2007,1,1,,5336691,A61K31/165,0,0,,,,,,,,,,,,,,,,,,,,,,,,
2047,"Dippin' Dots, Inc. v. Mosey",476 F.3d 1337,"2007-1 Trade Cases P 75,590",9/2/2007,1,1,,5126156,A23G9/52,0,0,,,,,,,,,,,,,,,,,,,,,,,,
2049,"MyMail, Ltd. v. America Online, Inc.",476 F.3d 1372,81 U.S.P.Q.2d 1832,20/2/2007,1,1,,6571290,G06F3/04847,0,0,,,,,,,,,,,,,,,,,,,,,,,,
2051,"Creative Internet Advertising Corp. v. Yahoo!, Inc.",476 Fed.Appx. 724,2011 WL 1522414,22/4/2011,1,1,District court erred in leaving a central question of claim construction to the jury; judge Clevenger dissents regarding claim construction,6205432,G06Q10/107,1,1,,,,,,,,,,,,,,,,,,,,,,,,
2052,Smartmetric Inc. v. American Exp. Co.,476 Fed.Appx. 742,2012 WL 1367398,11/4/2012,1,1,,6792464,G07F7/1008,1,0,,,,,,,,,,,,,,,,,,,,,,,,
2064,"Hakim v. Cannon Avent Group, PLC",479 F.3d 1313,81 U.S.P.Q.2d 1900,23/2/2007,1,2,,6321931,B65D43/0231,0,0,6357620,A47G19/2272,0,0,,,,,,,,,,,,,,,,,,,,
2070,"Liebel-Flarsheim Co. v. Medrad, Inc.",481 F.3d 1371,82 U.S.P.Q.2d 1113,22/3/2007,1,4,,5456669,A61M5/14546,0,0,5658261,A61M5/14546,0,0,5662612,A61M5/14546,0,0,5928197,A61M5/14546,0,0,,,,,,,,,,,,
2071,"Central Admixture Pharmacy Services, Inc. v. Advanced Cardiac Solutions, P.C.",482 F.3d 1347,82 U.S.P.Q.2d 1293,3/4/2007,1,1,,4988515,A61K31/197,0,0,,,,,,,,,,,,,,,,,,,,,,,,
2072,"ZapMedia Services, Inc. v. Apple Inc.",482 Fed.Appx. 533,2012 WL 1416265,25/4/2012,1,1,,7343414,H04N21/23109,0,0,,,,,,,,,,,,,,,,,,,,,,,,
2073,"Intamin Ltd. v. Magnetar Technologies, Corp.",483 F.3d 1328,82 U.S.P.Q.2d 1545,18/4/2007,1,1,,6062350,H02K49/04,1,1,,,,,,,,,,,,,,,,,,,,,,,,
2074,In re Omeprazole Patent Litigation,483 F.3d 1364,82 U.S.P.Q.2d 1643,23/4/2007,1,1,,6013281,A61K31/444,0,0,,,,,,,,,,,,,,,,,,,,,,,,
2075,Acumed LLC v. Stryker Corp.,483 F.3d 800,82 U.S.P.Q.2d 1481,12/4/2007,1,1,,5472444,A61B17/72,0,0,,,,,,,,,,,,,,,,,,,,,,,,
2076,"PODS, Inc. v. Porta Stor, Inc.",484 F.3d 1359,"2007 Copr.L.Dec. P 29,378",27/4/2007,1,1,,6071062,B60P1/6445,1,1,,,,,,,,,,,,,,,,,,,,,,,,
2077,"In re Transaction Holdings Ltd., LLC",484 Fed.Appx. 469,2012 WL 1392647,23/4/2012,1,1,,6945457,G06Q20/102,0,0,,,,,,,,,,,,,,,,,,,,,,,,
2078,"Walker Digital, LLC v. Microsoft Corp.",484 Fed.Appx. 496,2012 WL 1877600,24/5/2012,1,1,,6349295,G06F40/232,0,0,,,,,,,,,,,,,,,,,,,,,,,,
2093,"Foremost in Packaging Systems, Inc. v. Cold Chain Technologies, Inc.",485 F.3d 1153,82 U.S.P.Q.2d 1606,2/5/2007,1,1,,5924302,F25D3/14,0,0,,,,,,,,,,,,,,,,,,,,,,,,
2095,"Bass Pro Trademarks, L.L.C. v. Cabela's, Inc.",485 F.3d 1364,82 U.S.P.Q.2d 1364,6/4/2007,1,1,,5620227,A41D15/04,1,1,,,,,,,,,,,,,,,,,,,,,,,,
2105,Motionless Keyboard Co. v. Microsoft Corp.,486 F.3d 1376,82 U.S.P.Q.2d 1801,29/5/2007,1,1,,5332322,B41J5/10,0,0,,,,,,,,,,,,,,,,,,,,,,,,
2109,Honeywell Intern. Inc. v. Universal Avionics Systems Corp.,488 F.3d 982,82 U.S.P.Q.2d 1886,25/5/2007,1,2,,5839080,G05D1/0676,1,1,6092009,G08G5/0021,0,0,,,,,,,,,,,,,,,,,,,,
2124,"Biomedino, LLC v. Waters Technologies Corp.",490 F.3d 946,83 U.S.P.Q.2d 1118,18/6/2007,1,1,,6602502,G01N33/94,1,0,,,,,,,,,,,,,,,,,,,,,,,,
2128,"Saunders Group, Inc. v. Comfortrac, Inc.",492 F.3d 1326,83 U.S.P.Q.2d 1225,27/6/2007,1,1,,6899690,A61F5/04,1,1,,,,,,,,,,,,,,,,,,,,,,,,
2129,"Young v. Lumenis, Inc.",492 F.3d 1336,83 U.S.P.Q.2d 1191,27/6/2007,1,1,,6502579,A61B18/203,1,1,,,,,,,,,,,,,,,,,,,,,,,,
2134,"Honeywell Intern., Inc. v. Universal Avionics Systems Corp.",493 F.3d 1358,83 U.S.P.Q.2d 1425,3/7/2007,1,1,Judge Plager dissented,4914436,G05D1/0676,0,0,,,,,,,,,,,,,,,,,,,,,,,,
2145,Jang v. Boston Scientific Corp.,493 Fed.Appx. 70,2012 WL 3590823,22/8/2012,1,2,,5954743,A61F2/915,1,1,5922021,A61F2/915,1,1,,,,,,,,,,,,,,,,,,,,
2149,"Laserfacturing, Inc. v. Old Carco Liquidation Trust",494 Fed.Appx. 72,2012 WL 4054135,17/9/2012,1,1,,5595670,B23K15/006,0,0,,,,,,,,,,,,,,,,,,,,,,,,
2163,"In re Rembrandt Technologies, LP",496 Fed.Appx. 36,2012 WL 4017470,13/9/2012,1,1,,5243627,H03M13/27,0,0,,,,,,,,,,,,,,,,,,,,,,,,
2164,"Icon Health & Fitness, Inc. v. Octane Fitness, LLC",496 Fed.Appx. 57,2012 WL 5237021,24/10/2012,1,1,,6019710,A63B22/0664,0,0,,,,,,,,,,,,,,,,,,,,,,,,
2174,"SafeTCare Mfg., Inc. v. Tele-Made, Inc.",497 F.3d 1262,83 U.S.P.Q.2d 1618,3/8/2007,1,1,,6357065,A61G7/00,0,0,,,,,,,,,,,,,,,,,,,,,,,,
2183,"Joy MM Delaware, Inc. v. Cincinnati Mine Machinery, Co.",497 Fed.Appx. 970,2012 WL 5439885,8/11/2012,1,1,,6662932,B65G19/20,0,0,,,,,,,,,,,,,,,,,,,,,,,,
2186,"Ormco Corp. v. Align Technology, Inc.",498 F.3d 1307,84 U.S.P.Q.2d 1146,24/8/2007,1,1,,6616444,A61C3/00,1,1,,,,,,,,,,,,,,,,,,,,,,,,
2188,"BMC Resources, Inc. v. Paymentech, L.P.",498 F.3d 1373,84 U.S.P.Q.2d 1545,20/9/2007,1,2,,5718298,E21B21/063,0,0,5870456,G07F7/08,0,0,,,,,,,,,,,,,,,,,,,,
2189,Textron Innovations Inc. v. American Eurocopter Corp.,498 Fed.Appx. 23,2012 WL 3871717,7/9/2012,1,1,,5462242,B64C25/52,1,1,,,,,,,,,,,,,,,,,,,,,,,,
2191,Lighting Ballast Control LLC v. Philips Elecs. N. Am. Corp.,498 Fed.Appx. 986,2013 WL 11874,2/1/2013,1,1,,5436529,H05B41/298,1,1,,,,,,,,,,,,,,,,,,,,,,,,
2199,"L.B. Plastics, Inc. v. Amerimax Home Products, Inc.",499 F.3d 1303,84 U.S.P.Q.2d 1341,12/9/2007,1,1,,6463700,E04D13/076,0,0,,,,,,,,,,,,,,,,,,,,,,,,
