case_id,case_title,case_citation,parallel_cite,filed_date,not_rule36,number_of_patents,note,patent1,patent1_cpc,patent1_find_error,patent1_reverse,patent2,patent2_cpc,patent2_find_error,patent2_reverse,patent3,patent3_cpc,patent3_find_error,patent3_reverse,patent4,patent4_cpc,patent4_find_error,patent4_reverse,patent5,patent5_cpc,patent5_find_error,patent5_reverse,patent6,patent6_cpc,patent6_find_error,patent6_reverse,patent7,patent7_cpc,patent7_find_error,patent7_reverse
611,"Doyle v. Crain Industries, Inc.",243 F.3d 564,2000 WL 1608826,25/10/2000,1,1,,5120770,C08J9/127,0,0,,,,,,,,,,,,,,,,,,,,,,,,
614,"Alcide Corp. v. ABS Global, Inc.",243 F.3d 567,2000 WL 1737824,22/11/2000,1,1,,4330531,A61K8/20,0,0,,,,,,,,,,,,,,,,,,,,,,,,
615,"Cybersettle, Inc. v. National Arbitration Forum, Inc.",243 Fed.Appx. 603,2007 WL 2112784,24/7/2007,1,1,,6330551,G06Q10/10,1,1,,,,,,,,,,,,,,,,,,,,,,,,
619,"Mentor H/S, Inc. v. Medical Device Alliance, Inc.",244 F.3d 1365,58 U.S.P.Q.2d 1321,9/4/2001,1,1,,4886491,A61B17/22012,0,0,,,,,,,,,,,,,,,,,,,,,,,,
621,"Automed Technologies, Inc. v. Microfil, LLC",244 Fed.Appx. 354,2007 WL 2045697,16/7/2007,1,2,Judge Mayer dissents regarding claim construction of '927 patent,6449927,G07F11/44,0,0,6742671,G07F11/44,0,0,,,,,,,,,,,,,,,,,,,,
624,"Hallco Mfg. Co., Inc. v. Foster",245 F.3d 1369,58 U.S.P.Q.2d 1417,9/4/2001,1,1,,RE35022,,0,0,,,,,,,,,,,,,,,,,,,,,,,,
625,"Crystal Semiconductor Corp. v. TriTech Microelectronics Intern., Inc.",246 F.3d 1336,57 U.S.P.Q.2d 1953,7/3/2001,1,3,,4746899,H03M3/324,0,0,4851841,H03M3/488,0,0,5220483,H01L27/0805,0,0,,,,,,,,,,,,,,,,
626,"Bristol-Myers Squibb Co. v. Ben Venue Laboratories, Inc.",246 F.3d 1368,58 U.S.P.Q.2d 1508,20/4/2001,1,2,,5641803,A61K45/06,0,0,5670537,A61K45/06,1,1,,,,,,,,,,,,,,,,,,,,
627,"Schoell v. Regal Marine Industries, Inc.",247 F.3d 1202,58 U.S.P.Q.2d 1450,17/4/2001,1,1,,5456202,B63B1/20,0,0,,,,,,,,,,,,,,,,,,,,,,,,
628,"Telemac Cellular Corp. v. Topp Telecom, Inc.",247 F.3d 1316,58 U.S.P.Q.2d 1545,25/4/2001,1,1,,5577100,H04W4/24,0,0,,,,,,,,,,,,,,,,,,,,,,,,
629,"Electro Scientific Industries, Inc. v. General Scanning Inc.",247 F.3d 1341,58 U.S.P.Q.2d 1498,18/4/2001,1,1,,5265114,B23K26/06,0,0,5473624,B23K26/06,0,0,,,,,,,,,,,,,,,,,,,,
630,"Medtronic, Inc. v. Advanced Cardiovascular Systems, Inc.",248 F.3d 1303,58 U.S.P.Q.2d 1607,20/4/2001,1,1,,5653727,A61F2/88,0,0,,,,,,,,,,,,,,,,,,,,,,,,
633,Data Encryption Corp. v. Microsoft Corp.,248 Fed.Appx. 166,2007 WL 2574743,6/9/2007,1,1,,5584023,G06F21/6218,0,0,,,,,,,,,,,,,,,,,,,,,,,,
634,"Toshiba Corp. v. Juniper Networks, Inc.",248 Fed.Appx. 170,2007 WL 2574744,6/9/2007,1,4,,5835710,H04L12/4608,0,0,6343322,H04L12/4608,0,0,6598080,H04L12/4608,0,0,6341127,H04Q11/04,0,0,,,,,,,,,,,,
635,"Lockheed Martin Corp. v. Space Systems/Loral, Inc.",249 F.3d 1314,58 U.S.P.Q.2d 1671,30/4/2001,1,1,,4084772,B64G1/28,1,0,,,,,,,,,,,,,,,,,,,,,,,,
636,"Biotec Biologische Naturverpackungen GmbH & Co. KG v. Biocorp, Inc.",249 F.3d 1341,184 A.L.R. Fed. 669,14/5/2001,1,2,,5362777,C08J5/00,0,0,5280055,C08L1/10,0,0,,,,,,,,,,,,,,,,,,,,
637,"Maurice Mitchell Innovations, L.P. v. Intel Corp.",249 Fed.Appx. 184,2007 WL 2777968,24/9/2007,1,1,,4875154,G06F15/173,0,0,,,,,,,,,,,,,,,,,,,,,,,,
638,Eon-Net LP v. Flagstar Bancorp,249 Fed.Appx. 189,2007 WL 2818634,27/9/2007,1,1,,6683697,G06V10/22,0,0,,,,,,,,,,,,,,,,,,,,,,,,
640,"Kudlacek v. DBC, INC.",25 Fed.Appx. 837,2001 WL 1646654,21/12/2001,1,1,,5611325,F41B5/1426,0,0,,,,,,,,,,,,,,,,,,,,,,,,
641,"Hemphill v. McNeil-PPC, Inc.",25 Fed.Appx. 915,2001 WL 1504561,27/11/2001,1,1,,4557720,A61M31/007,0,0,,,,,,,,,,,,,,,,,,,,,,,,
642,"Budde v. Harley-Davidson, Inc.",250 F.3d 1369,58 U.S.P.Q.2d 1801,24/5/2001,1,1,,4955348,F02M35/10308,1,1,,,,,,,,,,,,,,,,,,,,,,,,
643,"Herstein v. Comptek Federal Systems, Inc.",250 F.3d 754,2000 WL 642500,18/5/2000,1,1,,4810981,H01P1/047,0,0,,,,,,,,,,,,,,,,,,,,,,,,
644,"Ta Instruments, Inc. v. Perkin-Elmer Corp.",250 F.3d 756,2000 WL 717094,1/6/2000,1,1,,4246641,G01K15/00,1,1,,,,,,,,,,,,,,,,,,,,,,,,
645,"Arthur S. Koenig and MDI Labs, Inc. v. Fugro-McClelland (Southwest), Inc.,",250 F.3d 756,2000 WL 723826,2/6/2000,1,1,,5076392,E21B25/00,0,0,,,,,,,,,,,,,,,,,,,,,,,,
648,"American Imaging Services, Inc. v. Intergraph Corp.",250 F.3d 757,2000 WL 772725,12/6/2000,1,1,,5353393,G06T11/00,0,0,,,,,,,,,,,,,,,,,,,,,,,,
649,"Magnivision, Inc. v. Bonneau Co.",250 F.3d 758,2000 WL 772323,15/6/2000,1,1,,5144345,B65D73/0064,1,1,,,,,,,,,,,,,,,,,,,,,,,,
650,"Microchip Tech., Inc. v. Scenix Semiconductor, Inc.",250 F.3d 759,2000 WL 945308,16/6/2000,1,1,,5606511,H02H3/247,0,0,,,,,,,,,,,,,,,,,,,,,,,,
651,"C.R. Bard, Inc. v. Medtronic, Inc.",250 F.3d 760,2000 WL 868581,29/6/2000,1,1,,5484474,A61M1/3627,1,1,,,,,,,,,,,,,,,,,,,,,,,,
652,"C.R. Bard, Inc. v. Boston Scientific Corp.",250 F.3d 761,2000 WL 915241,7/7/2000,1,1,,5087246,A61M25/1038,0,0,,,,,,,,,,,,,,,,,,,,,,,,
653,"General Surgical Innovations, Inc. v. Origin Medsystems, Inc.",250 F.3d 761,2000 WL 959507,10/7/2000,1,1,,5514153,A61M29/02,0,0,,,,,,,,,,,,,,,,,,,,,,,,
666,"Vermeer Manufacturing Co. v. Charles Machine Works, Inc.",251 F.3d 168,2000 WL 1742531,27/11/2000,1,1,,5556253,B65G59/062,1,1,,,,,,,,,,,,,,,,,,,,,,,,
671,"Acromed Corp. v. Sofamor Danek Group, Inc.",253 F.3d 1371,59 U.S.P.Q.2d 1130,8/6/2001,1,2,,4696290,A61B17/686,0,0,4854311,A61B17/7058,0,0,,,,,,,,,,,,,,,,,,,,
679,"Gart v. Logitech, Inc.",254 F.3d 1334,59 U.S.P.Q.2d 1290,26/6/2001,1,1,,4862165,G06F3/03543,1,1,,,,,,,,,,,,,,,,,,,,,,,,
687,Durel Corp. v. Osram Sylvania Inc.,256 F.3d 1298,59 U.S.P.Q.2d 1238,27/6/2001,1,3,,5418062,C23C16/442,1,1,5439705,C23C16/442,1,1,5156885,C23C16/442,1,1,,,,,,,,,,,,,,,,
689,"Interactive Gift Exp., Inc. v. Compuserve Inc.",256 F.3d 1323,59 U.S.P.Q.2d 1401,13/7/2001,1,1,,4528643,G11B27/031,1,1,,,,,,,,,,,,,,,,,,,,,,,,
691,"Tegal Corp. v. Tokyo Electron America, Inc.",257 F.3d 1331,59 U.S.P.Q.2d 1385,16/7/2001,1,1,,4464223,H01J37/32082,1,0,,,,,,,,,,,,,,,,,,,,,,,,
692,"Dow Chemical Co. v. Sumitomo Chemical Co., Ltd.",257 F.3d 1364,59 U.S.P.Q.2d 1609,25/7/2001,1,1,,4499255,C08G59/10,1,1,,,,,,,,,,,,,,,,,,,,,,,,
705,"Dayco Products, Inc. v. Total Containment, Inc.",258 F.3d 1317,59 U.S.P.Q.2d 1489,20/7/2001,1,5,,5129686,F16L33/213,0,0,5199752,F16L25/0036,1,1,5297822,F16L25/0036,1,1,5380050,F16L25/0036,1,1,5486023,F16L25/0036,1,1,,,,,,,,
707,"Pannu v. Storz Instruments, Inc.",258 F.3d 1366,59 U.S.P.Q.2d 1597,25/7/2001,1,1,,RE32525,,0,0,,,,,,,,,,,,,,,,,,,,,,,,
711,"Wleklinski v. Targus, Inc.",258 Fed.Appx. 325,2007 WL 4460620,19/12/2007,1,1,,4976388,A45C13/30,0,0,,,,,,,,,,,,,,,,,,,,,,,,
712,"MSM Investments Co., LLC v. Carolwood Corp.",259 F.3d 1335,59 U.S.P.Q.2d 1856,9/8/2001,1,1,,5071878,A61K31/17,0,0,,,,,,,,,,,,,,,,,,,,,,,,
714,Pall Corp. v. PTI Technologies Inc.,259 F.3d 1383,59 U.S.P.Q.2d 1763,7/8/2001,1,2,,4663041,B01D63/067,0,0,4609465,B01D63/067,1,1,,,,,,,,,,,,,,,,,,,,
719,PACTIV Corp.,26 Fed.Appx. 943,2002 WL 21944,4/1/2002,1,1,,5007143,B65D33/2541,0,0,,,,,,,,,,,,,,,,,,,,,,,,
720,"Saeilo Inc. v. Colt's Mfg. Co., Inc.",26 Fed.Appx. 966,2002 WL 59674,16/1/2002,1,1,,5415075,F41A19/35,0,0,,,,,,,,,,,,,,,,,,,,,,,,
721,Innovad Inc. v. Microsoft Corp.,260 F.3d 1326,59 U.S.P.Q.2d 1676,6/8/2001,1,1,,4882750,H04M1/275,1,0,,,,,,,,,,,,,,,,,,,,,,,,
722,"Day Intern., Inc. v. Reeves Brothers, Inc.",260 F.3d 1343,59 U.S.P.Q.2d 1790,9/8/2001,1,1,,4770928,B32B3/12,0,0,,,,,,,,,,,,,,,,,,,,,,,,
724,"Hyperphrase Technologies, LLC v. Google, Inc.",260 Fed.Appx. 274,87 U.S.P.Q.2d 1285,26/12/2007,1,2,,5903889,G06F40/12,1,1,6526321,A61N1/0565,1,1,,,,,,,,,,,,,,,,,,,,
725,"Black & Decker, Inc. v. Robert Bosch Tool Corp.",260 Fed.Appx. 284,2008 WL 60501,7/1/2008,1,1,,6788925,H04B1/06,1,1,,,,,,,,,,,,,,,,,,,,,,,,
730,"Outside Box Innovations, LLC v. Travel Caddy, Inc.",260 Fed.Appx. 316,2008 WL 145247,15/1/2008,1,1,Judge Dyk dissents regarding claim construction,6991104,A45C13/04,0,0,,,,,,,,,,,,,,,,,,,,,,,,
731,Viskase Corp. v. American Nat. Can Co.,261 F.3d 1316,59 U.S.P.Q.2d 1823,31/7/2001,1,4,,4863769,B32B27/08,1,0,4976898,B32B27/08,1,0,5059481,B32B27/08,1,1,5256351,B32B27/08,1,1,,,,,,,,,,,,
732,"Advanced Cardiovascular Systems, Inc. v. Scimed Life Systems, Inc.",261 F.3d 1329,59 U.S.P.Q.2d 1801,6/8/2001,1,5,,5421955,A61F2/86,1,1,5514154,A61F2/86,1,1,5603721,A61F2/86,1,1,5728158,A61F2/86,1,1,,,,,,,,,,,,
734,"Bell Atlantic Network Services, Inc. v. Covad Communications Group, Inc.",262 F.3d 1258,59 U.S.P.Q.2d 1865,17/8/2001,1,1,,5812786,H04M11/062,0,0,,,,,,,,,,,,,,,,,,,,,,,,
735,"Glaxo Group Ltd. v. Ranbaxy Pharmaceuticals, Inc.",262 F.3d 1333,59 U.S.P.Q.2d 1950,20/8/2001,1,1,,4562181,C07D501/34,1,1,,,,,,,,,,,,,,,,,,,,,,,,
736,"McGinley v. Franklin Sports, Inc.",262 F.3d 1339,60 U.S.P.Q.2d 1001,21/8/2001,1,1,,5407193,A63B43/00,0,0,,,,,,,,,,,,,,,,,,,,,,,,
740,Generation II Orthotics Inc. v. Medical Technology Inc.,263 F.3d 1356,59 U.S.P.Q.2d 1919,15/8/2001,1,2,,5400806,A61F5/0123,1,1,5302169,A61F5/0123,1,1,,,,,,,,,,,,,,,,,,,,
741,"Canon, Inc. v. GCC Intern. Ltd.",263 Fed.Appx. 57,2008 WL 213883,25/1/2008,1,1,"The claim construction was part of the reasoning behind the preliminary injunction, but there was no error found that would reverse or remand the case.",6336018,G03G21/186,1,0,,,,,,,,,,,,,,,,,,,,,,,,
742,"Emergis Technologies, Inc. v. PNM Resources",263 Fed.Appx. 63,2008 WL 249336,31/1/2008,1,1,,6044362,G06Q20/0425,1,1,,,,,,,,,,,,,,,,,,,,,,,,
753,"Surfco Hawaii v. Fin Control Systems Pty, Ltd.",264 F.3d 1062,60 U.S.P.Q.2d 1056,5/9/2001,1,3,,5328397,B63B32/66,1,1,5464359,B63B32/66,1,1,5672081,B63B32/66,1,1,,,,,,,,,,,,,,,,
754,TurboCare Div. of Demag Delaval Turbomachinery Corp. v. General Elec. Co.,264 F.3d 1111,60 U.S.P.Q.2d 1017,29/8/2001,1,1,,4436311,F01D11/025,1,1,,,,,,,,,,,,,,,,,,,,,,,,
755,"Kustom Signals, Inc. v. Applied Concepts, Inc.",264 F.3d 1326,60 U.S.P.Q.2d 1135,5/9/2001,1,1,Judge Mayer dissents regarding claim construction,5528246,G01S7/415,0,0,,,,,,,,,,,,,,,,,,,,,,,,
756,"Sandt Technology, Ltd. v. Resco Metal and Plastics Corp.",264 F.3d 1344,60 U.S.P.Q.2d 1091,6/9/2001,1,1,,5509057,H04M1/18,0,0,,,,,,,,,,,,,,,,,,,,,,,,
757,"Ecolab, Inc. v. Envirochem, Inc.",264 F.3d 1358,60 U.S.P.Q.2d 1173,6/9/2001,1,1,,RE32818,,1,1,,,,,,,,,,,,,,,,,,,,,,,,
758,"Kopykake Enterprises, Inc. v. Lucks Co.",264 F.3d 1377,60 U.S.P.Q.2d 1124,10/9/2001,1,1,,5017394,A23G3/28,0,0,,,,,,,,,,,,,,,,,,,,,,,,
762,"Advanced Cardiovascular Systems, Inc. v. Medtronic, Inc.",265 F.3d 1294,60 U.S.P.Q.2d 1161,10/9/2001,1,1,,5451233,A61B18/245,0,0,,,,,,,,,,,,,,,,,,,,,,,,
763,"Fin Control Sytems Pty, Ltd. v. OAM, Inc.",265 F.3d 1311,60 U.S.P.Q.2d 1203,12/9/2001,1,1,,5464359,B63B32/66,0,0,,,,,,,,,,,,,,,,,,,,,,,,
764,Hilgraeve Corp. v. Symantec Corp.,265 F.3d 1336,60 U.S.P.Q.2d 1291,17/9/2001,1,1,,5319776,H04L63/145,0,0,,,,,,,,,,,,,,,,,,,,,,,,
765,Brown v. 3M,265 F.3d 1349,60 U.S.P.Q.2d 1375,18/9/2001,1,1,Judge Mayer dissents regarding claim construction,5852824,G06F8/78,0,0,,,,,,,,,,,,,,,,,,,,,,,,
769,"Nazomi Communications, Inc. v. ARM Holdings, PLC",266 Fed.Appx. 935,2008 WL 482580,21/2/2008,1,1,,6332215,G06F9/30174,0,0,,,,,,,,,,,,,,,,,,,,,,,,
770,"Aristocrat Technologies Australia Pty Ltd. v. Multimedia Games, Inc.",266 Fed.Appx. 942,2008 WL 484449,22/2/2008,1,1,,4817951,G07F17/3244,1,1,,,,,,,,,,,,,,,,,,,,,,,,
772,Xerox Corp. v. 3Com Corp.,267 F.3d 1361,60 U.S.P.Q.2d 1526,5/10/2001,1,1,,5596656,G06F3/04883,0,0,,,,,,,,,,,,,,,,,,,,,,,,
778,Ballard Medical Products v. Allegiance Healthcare Corp.,268 F.3d 1352,60 U.S.P.Q.2d 1493,9/10/2001,1,2,,4569344,A61M16/0463,0,0,4696296,A61M16/0463,0,0,,,,,,,,,,,,,,,,,,,,
779,"Asyst Technologies, Inc. v. Empak, Inc.",268 F.3d 1364,60 U.S.P.Q.2d 1567,10/10/2001,1,1,,5097421,H01L21/67294,1,1,,,,,,,,,,,,,,,,,,,,,,,,
780,"J & M Corp. v. Harley-Davidson, Inc.",269 F.3d 1360,60 U.S.P.Q.2d 1746,2/11/2001,1,1,,RE34525,,0,0,,,,,,,,,,,,,,,,,,,,,,,,
784,Superior Fireplace Co. v. Majestic Products Co.,270 F.3d 1358,60 U.S.P.Q.2d 1668,1/11/2001,1,1,,5678534,F24B1/1808,0,0,,,,,,,,,,,,,,,,,,,,,,,,
789,Intermatic Inc. v. Lamson & Sessions Co.,273 F.3d 1355,61 U.S.P.Q.2d 1075,17/12/2001,1,1,,5280135,H02G3/14,1,1,,,,,,,,,,,,,,,,,,,,,,,,
793,Luma Corp. v. Stryker Corp.,273 Fed.Appx. 948,2008 WL 1013484,10/4/2008,1,1,,5740801,G06T7/20,0,0,,,,,,,,,,,,,,,,,,,,,,,,
795,Rexnord Corp. v. Laitram Corp.,274 F.3d 1336,60 U.S.P.Q.2d 1851,15/11/2001,1,1,,5634550,B65G17/08,1,1,,,,,,,,,,,,,,,,,,,,,,,,
806,Helena Laboratories Corp. v. Alpha Scientific Corp.,274 Fed.Appx. 900,2008 WL 1743857,16/4/2008,1,1,,5344666,B01L3/0293,0,0,,,,,,,,,,,,,,,,,,,,,,,,
809,"LNP Engineering Plastics, Inc. v. Miller Waste Mills, Inc.",275 F.3d 1347,61 U.S.P.Q.2d 1193,21/12/2001,1,2,,5019450,B29C45/0005,0,0,5213889,B29C70/521,0,0,,,,,,,,,,,,,,,,,,,,
811,Talbert Fuel Systems Patents Co. v. Unocal Corp.,275 F.3d 1371,61 U.S.P.Q.2d 1363,8/1/2002,1,1,,5015356,C10L1/023,0,0,,,,,,,,,,,,,,,,,,,,,,,,
815,"Smith & Nephew, Inc. v. Ethicon, Inc.",276 F.3d 1304,61 U.S.P.Q.2d 1065,12/12/2001,1,1,Judge Michael held a dissenting opinion with respect to claim construction.,5601557,A61F2/0811,1,1,,,,,,,,,,,,,,,,,,,,,,,,
816,"Rheox, Inc. v. Entact, Inc.",276 F.3d 1319,61 U.S.P.Q.2d 1368,8/1/2002,1,1,,5162600,A62D3/33,0,0,,,,,,,,,,,,,,,,,,,,,,,,
822,"Traffix Devices, Inc. v. Lakeside Plastics, Inc.",276 Fed.Appx. 972,2008 WL 1930722,14/4/2008,1,1,,5749673,E01F9/70,1,0,,,,,,,,,,,,,,,,,,,,,,,,
825,General Atomics Diazyme Laboratories Div. v. Axis-Shield ASA,277 Fed.Appx. 1001,2008 WL 2019490,12/5/2008,1,2,,5631127,C07H15/14,0,0,5958717,C07H15/14,0,0,,,,,,,,,,,,,,,,,,,,
830,"Vulcan Engineering Co., Inc. v. Fata Aluminium, Inc.",278 F.3d 1366,61 U.S.P.Q.2d 1545,5/2/2002,1,1,,4736787,B22D47/02,0,0,,,,,,,,,,,,,,,,,,,,,,,,
831,"Genlyte Thomas Group, LLC v. Arch Lighting Group, Inc.",278 Fed.Appx. 1004,2008 WL 2062248,14/5/2008,1,1,,5038254,F21S2/005,0,0,,,,,,,,,,,,,,,,,,,,,,,,
833,"Rattler Tools, Inc. v. Bilco Tools, Inc.",278 Fed.Appx. 1013,2008 WL 2165726,22/5/2008,1,5,,6216787,E21B37/00,0,0,6308781,E21B37/00,0,0,6354386,E21B37/00,0,0,6357539,E21B37/00,0,0,6491117,E21B37/00,0,0,,,,,,,,
834,"Epcon Gas Systems, Inc. v. Bauer Compressors, Inc.",279 F.3d 1022,61 U.S.P.Q.2d 1470,1/2/2002,1,1,,5118455,B29C45/1732,1,1,,,,,,,,,,,,,,,,,,,,,,,,
835,Bayer AG. v. Biovail Corp.,279 F.3d 1340,61 U.S.P.Q.2d 1675,7/2/2002,1,1,DC failed to construct,5264446,C07D211/90,1,1,,,,,,,,,,,,,,,,,,,,,,,,
836,"Tate Access Floors, Inc. v. Interface Architectural Resources, Inc.",279 F.3d 1357,61 U.S.P.Q.2d 1647,7/2/2002,1,1,,4625491,E04F15/02423,0,0,,,,,,,,,,,,,,,,,,,,,,,,
837,"Dana Corp. v. American Axle & Manufacturing, Inc.",279 F.3d 1372,61 U.S.P.Q.2d 1609,12/2/2002,1,2,,5643093,F16C3/02,1,1,5637042,F16C3/023,1,1,,,,,,,,,,,,,,,,,,,,
839,"LSI Industries, Inc. v. ImagePoint, Inc.",279 Fed.Appx. 964,2008 WL 2165340,22/5/2008,1,6,,5682694,G09F13/0413,1,1,5983543,G09F13/0413,1,1,6125565,G09F13/0413,1,1,6298589,G09F13/0413,1,1,6631576,G09F13/0413,1,1,6843011,G09F13/0413,1,1,,,,
840,"TALtech Ltd. v. Esquel Apparel, Inc.",279 Fed.Appx. 974,2008 WL 2165996,22/5/2008,1,1,,5568779,A41D27/10,0,0,,,,,,,,,,,,,,,,,,,,,,,,
842,"Southwestern Bell Telephone Co. v. Arthur A. Collins, Inc.",279 Fed.Appx. 989,2008 WL 2186018,27/5/2008,1,1,,4797589,H04Q11/06,0,0,,,,,,,,,,,,,,,,,,,,,,,,
843,"Smith Engineering Co., Inc. v. Eisenmann Corp.",28 Fed.Appx. 958,2002 WL 70440,17/1/2002,1,1,,4280416,F23G7/068,0,0,,,,,,,,,,,,,,,,,,,,,,,,
857,In re Omeprazole Patent Litigation,281 Fed.Appx. 974,2008 WL 2369864,10/6/2008,1,2,,4786505,A61K31/44,0,0,4853230,A61K31/415,0,0,,,,,,,,,,,,,,,,,,,,
864,"Realsource, Inc. v. Best Buy Co.",282 Fed.Appx. 821,2008 WL 2510603,23/6/2008,1,1,,5732136,G07F7/025,0,0,,,,,,,,,,,,,,,,,,,,,,,,
865,"Heuft Systemtechnik GMBH v. Industrial Dynamics Co., Ltd.",282 Fed.Appx. 836,2008 WL 2518562,25/6/2008,1,1,,6298974,B65G47/244,1,1,,,,,,,,,,,,,,,,,,,,,,,,
877,"Pickholtz v. Rainbow Technologies, Inc.",284 F.3d 1365,52 Fed.R.Serv.3d 210,3/4/2002,1,1,,4593353,G06F21/123,1,1,,,,,,,,,,,,,,,,,,,,,,,,
884,"Leggett & Platt, Inc. v. Hickory Springs Mfg. Co.",285 F.3d 1353,62 U.S.P.Q.2d 1266,2/4/2002,1,1,,5052064,A47C23/005,0,0,,,,,,,,,,,,,,,,,,,,,,,,
885,"Ecolab, Inc. v. Paraclipse, Inc.",285 F.3d 1362,62 U.S.P.Q.2d 1349,3/4/2002,1,1,,5365690,A01M1/145,1,1,,,,,,,,,,,,,,,,,,,,,,,,
886,"TechSearch, L.L.C. v. Intel Corp.",286 F.3d 1360,62 U.S.P.Q.2d 1449,11/4/2002,1,1,,5574927,G06F9/3836,0,0,,,,,,,,,,,,,,,,,,,,,,,,
888,"NeoMagic Corp. v. Trident Microsystems, Inc.",287 F.3d 1062,62 U.S.P.Q.2d 1482,17/4/2002,1,3,,5650955,G06F3/153,0,0,5703806,G06F3/153,1,1,,,,,,,,,,,,,,,,,,,,
890,"Fantasy Sports Properties, Inc. v. Sportsline.com, Inc.",287 F.3d 1108,62 U.S.P.Q.2d 1564,24/4/2002,1,1,,4918603,G09B19/00,0,0,,,,,,,,,,,,,,,,,,,,,,,,
900,"Fargo Electronics, Inc. v. Iris, Ltd., Inc.",287 Fed.Appx. 96,2008 WL 2570822,27/6/2008,1,2,,5755519,B41J17/36,1,0,,,,,,,,,,,,,,,,,,,,,,,,
901,"CCS Fitness, Inc. v. Brunswick Corp.",288 F.3d 1359,62 U.S.P.Q.2d 1658,3/5/2002,1,3,,5924962,B62M1/26,1,1,5938567,B62M1/26,1,1,5683333,B62M1/26,1,1,,,,,,,,,,,,,,,,
902,"Aspex Eyewear, Inc. v. Altair Eyewear, Inc.",288 Fed.Appx. 697,2008 WL 2950997,1/8/2008,1,3,,5737054,G02C9/00,1,1,6012811,G02C9/00,0,0,6092896,G02C9/00,0,0,,,,,,,,,,,,,,,,
904,"Genentech, Inc. v. Amgen, Inc.",289 F.3d 761,62 U.S.P.Q.2d 1640,29/4/2002,1,3,,4704362,C12N15/00,1,1,5221619,C12N15/00,1,1,5583013,C12N15/00,1,1,,,,,,,,,,,,,,,,
906,"Catalina Marketing International, Inc. v. Coolsavings.com, Inc.",289 F.3d 801,62 U.S.P.Q.2d 1781,8/5/2002,1,1,,4674041,G06Q30/02,1,1,,,,,,,,,,,,,,,,,,,,,,,,
908,"Transclean Corp. v. Bridgewood Services, Inc.",290 F.3d 1364,62 U.S.P.Q.2d 1865,21/5/2002,1,1,Judge Clevenger held a dissenting opinion with respect to claim construction.,5318080,F01M11/04,1,1,,,,,,,,,,,,,,,,,,,,,,,,
910,"Uniloc USA, Inc. v. Microsoft Corp.",290 Fed.Appx. 337,2008 WL 3539749,7/8/2008,1,1,Judge Michel dissents regarding claim construction,5490216,G06F21/10,0,0,,,,,,,,,,,,,,,,,,,,,,,,
912,"Brady Const. Innovations, Inc. v. Perfect Wall, Inc.",290 Fed.Appx. 358,2008 WL 3822559,15/8/2008,1,1,,RE39462,,0,0,,,,,,,,,,,,,,,,,,,,,,,,
918,"Beckson Marine, Inc. v. NFM, Inc.",292 F.3d 718,63 U.S.P.Q.2d 1031,30/5/2002,1,1,,4363350,E06B1/26,1,1,,,,,,,,,,,,,,,,,,,,,,,,
919,"Lexion Medical, LLC v. Northgate Technologies, Inc.",292 Fed.Appx. 42,2008 WL 4097481,28/8/2008,1,1,,5411474,A61M13/003,1,1,,,,,,,,,,,,,,,,,,,,,,,,
923,"Duratech Industries Intern., Inc. v. Bridgeview Mfg., Inc.",292 Fed.Appx. 931,2008 WL 4221637,12/9/2008,1,1,,6375104,B02C13/04,1,1,,,,,,,,,,,,,,,,,,,,,,,,
931,"Trintec Industries, Inc. v. Top-U.S.A. Corp.",295 F.3d 1292,63 U.S.P.Q.2d 1597,2/7/2002,1,1,,5818717,G04B19/10,1,1,,,,,,,,,,,,,,,,,,,,,,,,
935,"Cardiac Pacemakers, Inc. v. St. Jude Medical, Inc.",296 F.3d 1106,63 U.S.P.Q.2d 1725,11/7/2002,1,1,,4572191,A61N1/3925,0,0,,,,,,,,,,,,,,,,,,,,,,,,
956,"Honeywell Inc. v. Victor Co. of Japan, Ltd.",298 F.3d 1317,63 U.S.P.Q.2d 1904,1/8/2002,1,1,,4425501,G02B5/005,1,1,,,,,,,,,,,,,,,,,,,,,,,,
965,"Trovan, Ltd. v. Sokymat SA, Irori",299 F.3d 1292,63 U.S.P.Q.2d 1865,1/8/2002,1,1,Judge Michel dissents over claim construction,5281855,H01L24/02,1,1,,,,,,,,,,,,,,,,,,,,,,,,
966,"Teleflex, Inc. v. Ficosa North America Corp.",299 F.3d 1313,63 U.S.P.Q.2d 1374,21/6/2002,1,1,,5632182,F16C1/262,1,0,,,,,,,,,,,,,,,,,,,,,,,,
967,"Allen Engineering Corp. v. Bartell Industries, Inc.",299 F.3d 1336,63 U.S.P.Q.2d 1769,1/8/2002,1,1,,5108220,E04F21/247,1,1,,,,,,,,,,,,,,,,,,,,,,,,
968,"Bionx Implants, Inc. v. Linvatec Corp.",299 F.3d 1378,64 U.S.P.Q.2d 1145,15/8/2002,1,1,,4873976,A61B17/064,0,0,,,,,,,,,,,,,,,,,,,,,,,,
973,Okor v. Sega of America,30 Fed.Appx. 950,2002 WL 343415,5/3/2002,1,1,,4127849,G06T3/0031,0,0,,,,,,,,,,,,,,,,,,,,,,,,
974,"Abbott Laboratories v. TorPharm, Inc.",300 F.3d 1367,63 U.S.P.Q.2d 1929,13/8/2002,1,2,,4988731,C07C53/128,0,0,5212326,C07C53/128,0,0,,,,,,,,,,,,,,,,,,,,
982,In re Cruciferous Sprout Litigation,301 F.3d 1343,64 U.S.P.Q.2d 1202,21/8/2002,1,2,,5725895,A21D2/36,0,0,5968567,A21D2/36,0,0,,,,,,,,,,,,,,,,,,,,
991,"Bowers v. Baystate Technologies, Inc.",302 F.3d 1334,"2002 Copr.L.Dec. P 28,479",20/8/2002,1,1,,4933514,G06F3/046,1,1,,,,,,,,,,,,,,,,,,,,,,,,
992,"Jack Guttman, Inc. v. Kopykake Enterprises, Inc.",302 F.3d 1352,64 U.S.P.Q.2d 1302,30/8/2002,1,1,,6319530,A23G3/20,1,1,,,,,,,,,,,,,,,,,,,,,,,,
997,"Minnesota Min. & Mfg. Co. v. Chemque, Inc.",303 F.3d 1294,64 U.S.P.Q.2d 1270,30/8/2002,1,1,,5169716,H01B3/44,0,0,,,,,,,,,,,,,,,,,,,,,,,,
999,"BBA Nonwovens Simpsonville, Inc. v. Superior Nonwovens, LLC",303 F.3d 1332,64 U.S.P.Q.2d 1257,30/8/2002,1,1,,5397413,D04H3/16,0,0,,,,,,,,,,,,,,,,,,,,,,,,
1000,"Respironics, Inc. v. Invacare Corp.",303 Fed.Appx. 865,2008 WL 5216019,16/12/2008,1,4,,5148802,A61M16/204,0,0,5433193,A61M16/204,0,0,6105575,A61M16/205,1,1,6609517,A61M16/205,0,0,,,,,,,,,,,,
1004,"PIN/NIP, Inc. v. Platte Chemical Co.",304 F.3d 1235,64 U.S.P.Q.2d 1344,4/9/2002,1,1,,5622912,A01N47/20,1,1,,,,,,,,,,,,,,,,,,,,,,,,
1008,Schwing GmbH v. Putzmeister Aktiengesellschaft,305 F.3d 1318,64 U.S.P.Q.2d 1641,24/9/2002,1,1,,RE32657,,1,1,,,,,,,,,,,,,,,,,,,,,,,,
1009,"Creo Products, Inc. v. Presstek, Inc.",305 F.3d 1337,64 U.S.P.Q.2d 1385,17/9/2002,1,2,Circuit Judge Clevenger dissented,5163368,B41C1/04,0,0,5174205,B41C1/1033,0,0,,,,,,,,,,,,,,,,,,,,
1010,"Amazin' Raisins Intern., Inc. v. Ocean Spray Cranberries, Inc.",306 Fed.Appx. 553,2008 WL 5474244,31/10/2008,1,1,,5188861,A23B7/022,0,0,,,,,,,,,,,,,,,,,,,,,,,,
1011,"Vehicle IP, LLC v. General Motors Corp.",306 Fed.Appx. 574,2009 WL 27510,6/1/2009,1,1,Judge Mayer dissented,6535743,G08G1/096872,0,0,,,,,,,,,,,,,,,,,,,,,,,,
1017,"Electro Scientific Industries, Inc. v. Dynamic Details, Inc.",307 F.3d 1343,64 U.S.P.Q.2d 1781,7/10/2002,1,1,,5847960,B23K26/08,1,1,,,,,,,,,,,,,,,,,,,,,,,,
1019,Union Carbide Chemicals & Plastics Technology Corp. v. Shell Oil Co.,308 F.3d 1167,64 U.S.P.Q.2d 1545,20/9/2002,1,3,,4916243,B01J23/66,1,1,4908343,C07D301/10,0,0,5057481,B01J23/66,0,0,,,,,,,,,,,,,,,,
1020,"Texas Digital Systems, Inc. v. Telegenix, Inc.",308 F.3d 1193,64 U.S.P.Q.2d 1812,16/10/2002,1,4,,4845481,G04G21/025,1,1,4965561,G04G21/025,1,1,4734619,G09F9/33,1,1,4804890,G09F9/33,1,1,,,,,,,,,,,,
1021,"Schumer v. Laboratory Computer Systems, Inc.",308 F.3d 1304,64 U.S.P.Q.2d 1832,22/10/2002,1,1,,5768492,G06F3/0488,1,1,,,,,,,,,,,,,,,,,,,,,,,,
1022,Inverness Medical Switzerland GmbH v. Princeton Biomeditech Corp.,309 F.3d 1365,64 U.S.P.Q.2d 1926,31/10/2002,1,3,,5622871,G01N33/548,1,1,5602040,G01N33/54366,1,1,5656506,G01N33/54313,1,1,,,,,,,,,,,,,,,,
1023,Inverness Medical Switzerland GmbH v. Warner Lambert Co.,309 F.3d 1373,64 U.S.P.Q.2d 1933,31/10/2002,1,3,,5622871,G01N33/548,1,1,5602040,G01N33/54366,1,1,5656503,G01N33/548,1,1,,,,,,,,,,,,,,,,
1024,"All Dental Prodx, LLC v. Advantage Dental Products, Inc.",309 F.3d 774,64 U.S.P.Q.2d 1945,25/10/2002,1,1,,5213498,A61C9/00,0,0,,,,,,,,,,,,,,,,,,,,,,,,
1032,"Balboa Instruments, Inc. v. Gecko Electronique, Inc.",31 Fed.Appx. 658,2002 WL 450075,22/3/2002,1,1,,5559720,A61H33/0095,1,0,,,,,,,,,,,,,,,,,,,,,,,,
1034,Datapoint Corp. v. Standard Microsystems Corp.,31 Fed.Appx. 685,2002 WL 243431,15/2/2002,1,2,,5008879,H04L12/40032,0,0,5077732,H04L9/40,0,0,,,,,,,,,,,,,,,,,,,,
1036,"United Systems of Arkansas, Inc. v. Laser Substrates, Inc.",31 Fed.Appx. 703,2002 WL 243448,19/2/2002,1,1,,5836622,B42D15/02,1,0,,,,,,,,,,,,,,,,,,,,,,,,
1037,"Neutrik AG v. Switchcraft, Inc.",31 Fed.Appx. 718,2002 WL 315032,27/2/2002,1,1,,5205749,H01R13/71,0,0,,,,,,,,,,,,,,,,,,,,,,,,
1038,"Schreiber Foods, Inc. v. Beatrice Cheese, Inc.",31 Fed.Appx. 727,2002 WL 315187,27/2/2002,1,2,,5440860,B65B25/068,1,1,5701724,B65B25/068,1,1,,,,,,,,,,,,,,,,,,,,
1041,"Contech Stormwater Solutions, Inc. v. Baysaver Technologies, Inc.",310 Fed.Appx. 404,2009 WL 361376,13/2/2009,1,1,,5707527,F16K31/20,0,0,,,,,,,,,,,,,,,,,,,,,,,,
1043,"Middleton, Inc. v. Minnesota Mining and Manufacturing Co.",311 F.3d 1384,65 U.S.P.Q.2d 1138,27/11/2002,1,1,,4944514,B29C65/48,1,1,,,,,,,,,,,,,,,,,,,,,,,,
1044,Applied Medical Resources Corp. v. U.S. Surgical Corp.,312 Fed.Appx. 326,2009 WL 440464,24/2/2009,1,1,,5385553,A61M39/06,0,0,,,,,,,,,,,,,,,,,,,,,,,,
1048,"Amgen Inc. v. Hoechst Marion Roussel, Inc.",314 F.3d 1313,65 U.S.P.Q.2d 1385,6/1/2003,1,5,,5547933,C07K14/505,0,0,5618698,C12N15/85,0,0,5621080,C07K14/505,0,0,5756349,C12N15/85,0,0,5955422,C07K14/505,0,0,,,,,,,,
1050,"Plant Genetic Systems, N.V. v. DeKalb Genetics Corp.",315 F.3d 1335,65 U.S.P.Q.2d 1452,13/1/2003,1,1,,5561236,A01H1/00,0,0,,,,,,,,,,,,,,,,,,,,,,,,
1055,"Oakley, Inc. v. Sunglass Hut Intern.",316 F.3d 1331,65 U.S.P.Q.2d 1321,9/1/2003,1,1,,5054902,G02B5/286,1,0,,,,,,,,,,,,,,,,,,,,,,,,
1059,"Medegen MMS, Inc. v. ICU Medical, Inc.",317 Fed.Appx. 982,90 U.S.P.Q.2d 1088,20/11/2008,1,1,Judge Walker dissented,5730418,A61M39/26,1,1,,,,,,,,,,,,,,,,,,,,,,,,
1060,Rambus Inc. v. Infineon Technologies Ag,318 F.3d 1081,65 U.S.P.Q.2d 1705,29/1/2003,1,4,,5954804,G11C7/1066,1,1,5953263,G11C7/1066,1,1,6034918,G11C7/1066,1,1,6032214,G11C7/1066,1,1,,,,,,,,,,,,
1061,"Biogen, Inc. v. Berlex Laboratories, Inc.",318 F.3d 1132,65 U.S.P.Q.2d 1809,31/1/2003,1,2,,5376567,C07K14/565,0,0,5795779,C07K14/565,0,0,,,,,,,,,,,,,,,,,,,,
1062,"Prima Tek II, L.L.C. v. Polypap, S.A.R.L.",318 F.3d 1143,65 U.S.P.Q.2d 1818,5/2/2003,1,2,,5410856,G09F23/00,1,1,5615532,A01M1/02,1,1,,,,,,,,,,,,,,,,,,,,
1063,"Altiris, Inc. v. Symantec Corp.",318 F.3d 1363,65 U.S.P.Q.2d 1865,12/2/2003,1,1,,5764593,G06F11/2294,1,1,,,,,,,,,,,,,,,,,,,,,,,,
1068,"Phonometrics, Inc. v. Westin Hotel Co.",319 F.3d 1328,65 U.S.P.Q.2d 1949,12/2/2003,1,1,,3769463,,0,0,,,,,,,,,,,,,,,,,,,,,,,,
1069,"Intel Corp. v. VIA Technologies, Inc.",319 F.3d 1357,65 U.S.P.Q.2d 1934,14/2/2003,1,1,,6006291,G06F3/14,0,0,,,,,,,,,,,,,,,,,,,,,,,,
